"Frantic Soft Cartoon Animal Velvet Plush School Backpack Bag For 2 To 5 Years Boys/Girls - Nursery, Preschool, Picnic",https://www.amazon.in//Frantic-Cartoon-Velvet-Preschool-Nursery/dp/B09KY5541N/ref=sr_1_153?keywords=bags&qid=1692642769&sprefix=%2Caps%2C415&sr=8-153,₹309,3.8 out of 5 stars,"(4,614)"," Care Instructions: Hand Wash Only  
 DIMENSIONS – 14 Length x 10 Width x 3 Height in inches.; MATERIAL TYPE – high quality washable felt velvet used which is non toxic and soft and skin friendly fabric. Ideal for Preschool / Nursery Kids. <br>  
 FEATURES – Light weight and soft fabric and it come with adjustable shoulder straps, which greatly reduce the pressure to shoulders. Also it has enough space for store things like toys, lunch box, fruits, small books, pencil box and other stationery items. <br>  
 The toddler backpack features with two adjustable shoulder straps and a top handle fit small children of all ages, and allows you to comfortably and easily adjust this backpack to fit boys and girls of different sizes <br>  
 The toddler bag have one small front pocket and a main compartment. You can put some small children's things in it, like Books, small books, pens, etc. Super cute pattern and design will make your small preschool or grade school children excited to head off to school with this bookbag! Also ideal for going to the zoo, playing at the park, traveling and any other outdoor activities <br>  
 Water Resistance Level: Water Resistant; Color Name: PUYellowNinjaTiger  
","This Attractive School bag is tailored keeping in mind kid’s hectic school work load. It is so spacious, trendy and attractive that your school going children will love to carry. It is not only superior in quality and finish but also very durable and sturdy! - Description This bag is made of durable materials for long lasting. It has 2 compartments. This Bag is Suitable for Age Group 1-5 Years going to Play School or Nursery. Whether Your Toddler or Kid Is Heading Off To School Or Going On Their First Big Adventure, Your Little One Will Love Carrying Their Very Own Backpack. - Perfect For:Preschool, Daycare, Hiking And Day Trips. A Perfect Backpack For Toddlers Headed To Preschool or Daycare. - Features: Include Roomy Main Zipper Pocket, Handle, Adjustable Shoulder Straps. - Specification: Material: VelvetSuit for: 1-5 years old childrenCompartments: 2 - Gift idea:This backpack is very beautiful and perfectly designed for your child.For Your Baby, it's the perfect gift for cuteness, softness",Frantic,B09KY5541N
"Genie Spray School Bag for Girls, 19 inch Backpack for Women, 3 compartments Water Resistant Stylish and Trendy College Backpacks for Girls",https://www.amazon.in//Genie-Ltrs-School-Backpack-SPRAY19SBBLU/dp/B07QFF2RZR/ref=sr_1_154?keywords=bags&qid=1692642769&sprefix=%2Caps%2C415&sr=8-154,"₹1,155",4.0 out of 5 stars,"(1,657)"," Outer Material: Nylon, Color: Blue; Water resistant  
 Capacity: 36 liters; Weight: 665 grams; Dimensions: 48 cms x 33 cms x 23 cms (LxWxH)  
 Number of compartments: 3  
 Laptop Compatibility: NoStrap Type: Ergonomic  
 Special Features: Back Padding; Age Range Description: Kid; Pocket Description: Utility Pocket; Closure Type: Zipper  
 3 Main Compartment, 2 External Pocket, 2 Side Stash Pockets, Back Padded Mesh  
","With bold geometric print, the Genie spray backpack is perfect to stand out amongst your friends. Made with nylon twill, the feather-light pack comes with an insulated front pocket to keep lunch warm. The spacious three compartment bag has an additional front pocket, a secret compartment.","Safari Industries (India) Ltd, Safari Industries Ltd 301/302, A-Wing, The Qube, M.V.Road, Marol, Andheri(East), Near international Airport Mumbai- 400059 +91-22-40381851/838",B07QFF2RZR
"Half Moon 35 Ltrs Water Resistant 15.6 inch Laptop Bag for Men/Backpack for Men, Navy Blue | Office Bag for Men/Office Bag for Women with Padded Laptop Compartment | Rain Cover & Reflective Strips",https://www.amazon.in//sspa/click?ie=UTF8&spc=MToyNjIzNTkxOTAxOTU1NTk3OjE2OTI2NDI3Njk6c3BfbXRmOjIwMTQ2NTQzMDk0NDk4OjowOjo&url=%2FHalf-Moon-Waterproof-Backpack-Students%2Fdp%2FB085MHDJ93%2Fref%3Dsr_1_155_sspa%3Fkeywords%3Dbags%26qid%3D1692642769%26sprefix%3D%252Caps%252C415%26sr%3D8-155-spons%26sp_csd%3Dd2lkZ2V0TmFtZT1zcF9tdGY%26psc%3D1,₹649,3.9 out of 5 stars,"(16,960)"," Care Instructions: Hand Wash Only  
 SPACIOUS AND LIGHTWEIGHT: Light weight & spacious laptop bag for men comes with 3 compartments. One is for carrying laptop inside (Upto 17""), with padding for safety, and space for laptop accessories like charger, etc. Second compartment of office bag for men is for books, files & all your day to day essentials. And third compartment of backpack for men is for your extra stuff. Laptop backpacks for men has provision for holding bottles on both sides & has padded shoulder straps for your comfort  
 COMFORT WITH QUALITY: This backpack for men has Wide, Padded & Adjustable shoulder straps & Padded Back for comfort in carrying heavy items. The laptop bag for men is stitched properly & Bartacks on every pressure point for extra durability. The office bag for men are made with strong yet light weight polyester fabric with heavy zippers. College Bags for men also comes with a Rain cover so that you can travel during rainy season without any problem. This laptop bag can be used by everyone.  
 SMART & TRENDY LOOKS: This Large backpack for men is smart, trendy and stylish in looks. The multipurpose college bags for men looks smart, athletic and venturesome and the blend of grey and red makes it appear exquisite. Your hiking trips, mountaineering experience cannot get completed without this amazing trekking backpack. PREMIUM FABRIC : Premium Polyester, Stylish and durable backpack for school /college and travel. Easily accommodate a laptop. Size: 45 cm X 31 cm X 22 cm  
 ENDURING & LONG LASTING LAPTOP BACKPACK: This trekking backpack for men/laptop bag for men is made up of highly durable material, which makes it suitable for all weather conditions including rains & extreme scorching heat. It will not only keep the inside stuff safe but will also resist damage to itself. We have designed the bag keeping your comfort in mind. Shoulder has high density padding, with 3D ventilated air foam padding to prevent sweating & to help you lift heavy objects easily.  
 OTHER FEATURES OF LAPTOP BAG FOR MEN: The office bag for men / office bag for women has Strong and durable zippers, Adjustable Shoulder Handles (Straps) , 2 Bottle/Umbrella holders , Padded Handle , Padded Laptop Compartment (can carry laptops of size 13, 14, 15.6 & 17 inches), Reflector Logo.  
",,"Amazing Bags, Half_Moon, New Delhi",B085MHDJ93
"uppercase 26 Ltrs Ryder Professional Laptop Backpack (15.6 Inch) 3x more water resistant sustainable bags with rain proof zippers for Men, Women, Boys and Girls, 750 Days warranty",https://www.amazon.in//sspa/click?ie=UTF8&spc=MToyNjIzNTkxOTAxOTU1NTk3OjE2OTI2NDI3Njk6c3BfbXRmOjIwMTI3NjgzODcyMzk4OjowOjo&url=%2FUPPERCASE-Professional-Backpack-resistant-sustainable%2Fdp%2FB0BXFDK5J2%2Fref%3Dsr_1_156_sspa%3Fkeywords%3Dbags%26qid%3D1692642769%26sprefix%3D%252Caps%252C415%26sr%3D8-156-spons%26sp_csd%3Dd2lkZ2V0TmFtZT1zcF9tdGY%26psc%3D1,"₹2,400",4.3 out of 5 stars,(78)," Care Instructions: Wipe with Damp Cloth  
 Handcrafted with care and made up of premium quality robust material  
 GRS certified for sustainability; The GRS (Global Recycled Standard) is intended for use with any product that contains at least 50% Recycled Material (License No. CMPY-158596); 750 days of international warranty  
 Padded laptop compartment fits up to 15.6"" Laptop, Tablet Sleeve; Back padding with Air mesh; Front access pocket for you to easily carry important small items with a bottle holder on the side  
 Wrinkle free bag and 3x more water resistant with Rainproof zippers; Trolley sleeve to securely place the bags on the luggage; Top Gadget Pocket; Internal Organiser  
",,"Acefour Accessories Pvt. Ltd., Acefour Accessories Pvt. Ltd. , Lodha Supremus Corp. Tower, Unit 1202,12th Floor,Saki Vihar road, Chandivali, Tunga Village, Opp. MTNL office, Andheri E, Mumbai -400072, Maharashtra, India. Customer Care Email  customercare@uppercase.co.in & Contact no. +91 8691 800 800",B0BXFDK5J2
Gear Classic 20L Faux Leather Water Resistant Anti Theft Laptop Bag/Backpack for Men/Women-Black,https://www.amazon.in//Gear-Classic-Leather-Backpack-LBPCLSLTH0101/dp/B07G4D13LB/ref=sr_1_157?keywords=bags&qid=1692642769&sprefix=%2Caps%2C415&sr=8-157,₹979,4.4 out of 5 stars,"(2,735)"," Outer material: synthetic, color: black; Waterproof  
 Capacity: 20 liters; Weight: 560 grams; Dimensions: 48 cms x 32 cms x 14 cms (LxWxH)  
 Number of compartments: 2  
 Laptop compatibility: yes, laptop size: 16strap type: adjustable  
 Special Features: Back Padding; Closure Type: Zipper; Age Range Description: Adult; Pocket Description: Utility Pocket  
 Concealed quick access Pockets on back panel ,Adjustable Anti sweat padded Shoulder straps , Padded Laptop sleeve,2 External Pockets, Padded Back Panel Cushioned with Anti Sweat Fabric,Embedded Organizer , USB and Headphone cable slot .  
",,,
Martucci 16 inch 36L Casual Waterproof Backpack/Office Bag/School Bag/College Bag/Business Bag/Unisex Travel Backpack,https://www.amazon.in//Martucci-Waterproof-Backpack-College-Business/dp/B0B1HM2ZGX/ref=sr_1_158?keywords=bags&qid=1692642769&sprefix=%2Caps%2C415&sr=8-158,₹599,3.8 out of 5 stars,(199)," Care Instructions: Hand Wash Only  
 MADE OF DURABLE MATERIAL & SOLID : Made of Durable Nylon Fabric with metal zippers. Ensure a secure & long-lasting usage everyday & weekend. Serve you well as professional office work bag.<br><br>  
 WATER REPELLENT & MULTIPURPOSE : PADDED shoulder Straps offer LIGHT-WEIGHT Carrying, Perfects for business traveling, weekend getaways, shopping, professional office work and other outdoor activities. Also, a perfect college high school student backpack for Boys, girls, teens, women and men.<br><br>  
 FUNCTIONAL & SAFE : 2 Big Compartments to store more your belongs well and External pocket for Quick access to your basic needs like key, sun glasses and your other valuable items.<br><br>  
 LOTS OF STORAGE SPACE & POCKETS : One separate Notebook compartment.One spacious packing compartment roomy for daily necessities, Tech electronics accessories. With many pockets make your items organized and easier to find.<br><br>  
 Lining Description: Polyester; Pattern Name: Self Design; Pocket Description: Utility Pocket; Material Type: Polyester; Color Name: Navy Blue; Age Range Description: Adult; Special Features: Back Padding<br>  
","Mrtucci Casual Laptop Backpack Practical trend backpack, both very convenient to incorporate digital equipment, but also to give you large capacity main pockets to put some clothes, some books, bottle or something else. Multipurpose: suitable for business, school, hiking, travelling, camping, sports, school. To meet all your travel needs. Durable: made with superior quality Nylon fabric material and ensured for maximum durability and making the texture become ultra-durable and better ventilation not easy to deformation. This bag will last for many years. Comfortable: breathable mesh and wide shoulder straps with plentiful sponge padding help relieve the stress from your shoulder. You can to adjust the length of the shoulder straps if you need. Well-made and designed: it's attractive and functional looking. The whole backpack were designed and built very well and there are two compartments and reduced burden system designed.",Martuci,B0B1HM2ZGX
House of Quirk Baby Diaper Bag Maternity Backpack (Blue Elephant Printed),https://www.amazon.in//House-Quirk-Maternity-Backpack-Elephant/dp/B07QV7SH4S/ref=sr_1_159?keywords=bags&qid=1692642769&sprefix=%2Caps%2C415&sr=8-159,"₹1,448",4.2 out of 5 stars,"(3,938)"," DURABLE MATERIAL:Diaper bags made of environmental and durable oxford material,water resistant and easy to wipe clean, strong zippers,you'll have a diaper backpack that lasts for years.  
 LARGE CAPACITY: Dimension L x W x H 41 x 18 x 25.5 cm, 16.1"" x 7.0"" x 10.0"" inch,it is very roomy and contains individual functional pockets, can hold all your essential items for baby care,such as baby diaper,milk bottle towel,water bottle, changing pad,snacks.  
 MULTI FUNCTION: You can use this bag as backpack and handbag. It is very elegant and suitable for many occasion like shopping, traveling etc. A fashionable backpack that can be carried by moms and dads alike.  
 WELL-DESIGNED:Wet and Dry Separation design,don't worry for baby's wet cloth, you can put the wet cloth in the separated inner pocket,A zipper in the back of the bag can be opened for easy access,wide mouth design top opening can offer you a large view.  
 BEST GIFT IDEA:Perfect baby shower gift for a special new Mommy,we designed a compact diaper backpack that combines style, versatility and convenience.suitable for many occasions like shopping, restaurant, traveling etc.Great for a wedding gift,business gift,New mother gift,holiday gift etc.  
›
",,,
"POLESTAR Noble 32 L Bag for College, School, Office, Casual Multipurpose Backpack with 15.6"" Laptop Compartment, Water Resistant, Unisex Design, Stylish & Durable, 1 Year Warranty",https://www.amazon.in//POLESTAR-Casual-bagpack-School-Backpack/dp/B07PQQ8M7B/ref=sr_1_160?keywords=bags&qid=1692642769&sprefix=%2Caps%2C415&sr=8-160,₹619,3.9 out of 5 stars,"(17,729)"," ✅DIMENSIONS: 31 Cm x 22 Cm x 45 Cm, CAPACITY: 32 Litres  
 ✅NUMBER OF COMPARTMENTS: 3 full size compartments & 2 side pockets, LAPTOP COMPARTMENT: Padded laptop compartment with elasticated strap lock, LAPTOP SIZE: 13 to 15.6 inches  
 ✅MATERIAL: Polyester, Water Resistant, COLOR: Navy Blue  
 ✅SPECIAL FEATURES: Ergonomic design, lightweight, padded breathable mesh back with adjustable straps, smooth & durable zippers, padded haul loop, 2 bottle/ umbrella easy access pockets  
 ✅CONSUMER: Suitable for men, women, students, boys & girls, can be used as school, college, office or day travelling backpacks, WARRANTY: 12 Months, Make in India product  
",,"POLESTAR, JAI AMBAY ENTERPRISES ,03AAFFJ0421M1ZQ, B -29 ,Sports & Surgical complex,Kapurthala Road, Jalandhar Punjab 140021 India . +91 9914112308 , polestarbags@gmail.com",B07PQQ8M7B
Gear DOUBLE DECKER 31L Water Resistant Laptop Bag/Backpack/Office Bag for Men/Women (Navy-Tan),https://www.amazon.in//Gear-DOUBLE-Resistant-Backpack-Navy-Tan/dp/B0BTJ2T26W/ref=sr_1_161?keywords=bags&qid=1692642769&sprefix=%2Caps%2C415&sr=8-161,"₹1,189",3.5 out of 5 stars,(25)," Ergonomic Shape : Spacious Compartments : Intuitive Access : Water Resistant : Light-weight  
 Front Panel made of Premium Faux Leather Fabric : Cushioned Grab Handle : Padded Base : Optimized Back Panel with Premium Cushioning & Airflow Mechanism : Padded 360 Laptop Sleeve with Velcro Fastener Fits Laptop up to 17"" : Premium Long Lasting Zippers & Pullers : Compression Straps on the Sides for Keeping the Contents Compact  
 Zippered Quick Access Pocket : Elasticated Bottle Pocket : Embedded Organiser : Elasticated Trolley Sleeve on Back Panel  
",Each Gear Bag is born in our in-house design & prototyping studio & characterises a recognisable aesthetic & functionality,"Gear Merchandise Pvt Ltd, Gear Merchandise Pvt Ltd, E/12 West Chowbaga, Gulshan Colony, Kolkata 700100",B0BTJ2T26W
Priority ARC 56 cm Red Polyester 2 Wheel Duffle Trolley Bag | Travel Luggage for Men & Women,https://www.amazon.in//Priority-ARC-Red-Polyester-Trolley/dp/B08HHD4T6W/ref=sr_1_162?keywords=bags&qid=1692642769&sprefix=%2Caps%2C415&sr=8-162,₹699,4.1 out of 5 stars,(328)," Outer Material: Polyester, Color: Red  
 Not wear resistant, Water resistant  
 Capacity: 45 liters; Weight: 1600 grams; Dimensions: 55.88 cms x 29.21 cms x 31.75 cms (LxWxH)  
 Number of Wheels: 2, Number of compartments: 2  
 Laptop Compatibility: No, Handle Type: Extendable, Strap Type: Adjustable  
 Capacity - 45 Litres  
","Priority duffle bag uses high density fabric materials to devise bags in lightweight, durable and fashionable style. We use highest quality fabric that's water resistant. The inner lining fabric is ensured to have a soft touch feel with high quality zipper. The long adjustable shoulder strap increases the ease on your shoulders. With this unisex duffle bag, you can pack all your belongings using the multiple compartments and pockets. Travel comfortably and fashionably with our #made in India bag.","High Spirit Commercial Ventures Pvt Ltd. Contact No. 7700910835, High Spirit Commercial Ventures Pvt Ltd. Contact no .  7700910835",B08HHD4T6W
"WILD MODA Women's Shoulder Bag, Set of 1",https://www.amazon.in//WILD-MODA-Womens-Shoulder-Turquoise/dp/B099PLT91X/ref=sr_1_163?keywords=bags&qid=1692642769&sprefix=%2Caps%2C415&sr=8-163,₹849,4.2 out of 5 stars,"(3,368)"," Ample Compartments : The handbag will fulfil all your storage needs with its 3 big compartments and 6 pockets having a capacity of holding 20L of weight. The spacious compartments can keep all your stuff from your ipad, and smartphone to your kid’s diapers or your makeup kit and the side pocket can keep your water bottle or umbrella and take them out anytime without the need of opening and closing the zipper lock every time.  
 High-quality Polyester : he stylish bag is constructed in premium quality waterproof polyester material which makes it a durable option. You can carry all your stuff with ease as the high-quality material of the bag ensures no breakage or damage to the bag due to weight. The waterproof material saves all your stuff from getting wet and the imported quality zippers ensure that they will not break or lose their shine even after continuous usage.  
 Soft Fabric : As the bag's fabric is so comfortable to the touch, carrying it won't bother you. The shoulder straps of the bag are made from extra soft material which makes sure that the straps do not cause any itching or irritation even after continuous usage. So, you don't have to be concerned about the straps hurting your shoulders.  
 Classy and Stylish : The solid finish of the bag gives it a dash of style and class. You can take it anywhere from parties to the office and the bag will be your best style buddy everywhere. No matter if you are an office-going girl or a college girl, you can make a style statement with this bag. Every girl's wardrobe needs this bag because of its flawless finish, which elevates it to must-have status.  
 Light Feel : Even with all of your belongings inside this high-quality bag, which weighs only 400 grams and won't add to your burden when carried, you'll feel light. The shoulder straps of the bag make sure that it rests perfectly on your shoulders and you don't feel too much weight ensuring that even after carrying the bag for hours, your shoulders won't feel any pain on your shoulders.  
 Warranty: 6 months domestic warranty on manufacturing defects, Covered in Warranty: Zippers & Sliders, Not Covered in Warranty:Cloth Material, Care Instructions: Do not expose to extreme heat  
",,"WILD MODA, wildmoda@gmail.com",B099PLT91X
"Zebronics Techshield A1, 18 Liters, 1 Compartment Laptop Backpack and Front Pocket, fit Up to 15.6-inch Laptop, Polyester Fabric, Office Use and Mini Business Travel Bags (Black)",https://www.amazon.in//Zebronics-Techshield-Compartment-15-6-inch-Polyester/dp/B0C6QTMYFG/ref=sr_1_164?keywords=bags&qid=1692642769&sprefix=%2Caps%2C415&sr=8-164,₹634,5.0 out of 5 stars,(4)," The Zebronics Techsheild A1 backpack comes with 2 compartments,adjustable shoulder straps,side mesh for keeping bottle.  
 The backpack contains a unique secret pocket on the backside of the backpack.  
 It contains spacious front pocket that can accommodate your belonging efficiently.  
 You can keep assets you need for immediate access.Also it contains a safe laptop compartment when you can keep a 15.6inch laptop or smaller ones easily.  
 Water-resistant, good quality zipper, light weight.  
 It has a Padded Adjustable Shoulder Straps and a trolley support strap for maximum comfort and to make your travel journey  
›
","Zebronics Techsheild A1, 18 Liters, 1 Compartment Laptop Backpack and front pocket, fit Up to 15.6-inch Laptop, Polyester Fabric, Office Use and Mini Business Travel Bags (Black)",,
"uppercase Apex Professional Laptop Backpack (15.6 Inch) 3x more water resistant sustainable bags with rain proof zippers for Men, Women, Boys and Girls, 750 Days warranty",https://www.amazon.in//sspa/click?ie=UTF8&spc=MToyNjIzNTkxOTAxOTU1NTk3OjE2OTI2NDI3Njk6c3BfYnRmOjIwMTI1ODk5OTIwNjk4OjowOjo&url=%2FUppercase-Professional-Backpack-Resistant-Sustainable%2Fdp%2FB0BWNBQXDZ%2Fref%3Dsr_1_165_sspa%3Fkeywords%3Dbags%26qid%3D1692642769%26sprefix%3D%252Caps%252C415%26sr%3D8-165-spons%26sp_csd%3Dd2lkZ2V0TmFtZT1zcF9idGY%26psc%3D1,"₹1,800",4.4 out of 5 stars,(89)," Care Instructions: Wipe with Damp Cloth  
 Handcrafted with care and made up of premium quality robust material  
 Padded laptop compartment fits up to 15.6"" Laptop, Back padding with Air mesh; Front access pocket for you to easily carry important small items with a bottle holder on the side  
 Wrinkle free bag and 3x more water resistant with Rainproof zippers; Trolley sleeve to securely place the bags on the luggage; Top Slip In Pocket  
 GRS certified for sustainability; The GRS (Global Recycled Standard) is intended for use with any product that contains at least 50% Recycled Material (License No. CMPY-158596); 750 days of international warranty  
",,"Acefour Accessories Pvt. Ltd., Acefour Accessories Pvt. Ltd. , Lodha Supremus Corp. Tower, Unit 1202,12th Floor,Saki Vihar road, Chandivali, Tunga Village, Opp. MTNL office, Andheri E, Mumbai -400072, Maharashtra, India. Customer Care Email  customercare@uppercase.co.in & Contact no. +91 8691 800 800",B0BWNBQXDZ
Veneer Synthetic Leather 30 Litre Casual 15.6 Inch Laptop Shoulder Business Travel Backpack for Unisex,https://www.amazon.in//sspa/click?ie=UTF8&spc=MToyNjIzNTkxOTAxOTU1NTk3OjE2OTI2NDI3Njk6c3BfYnRmOjIwMTY2ODA2ODMyODk4OjowOjo&url=%2FVeneer-Synthetic-Shoulder-Business-Backpack%2Fdp%2FB0C594SZQ7%2Fref%3Dsr_1_166_sspa%3Fkeywords%3Dbags%26qid%3D1692642769%26sprefix%3D%252Caps%252C415%26sr%3D8-166-spons%26sp_csd%3Dd2lkZ2V0TmFtZT1zcF9idGY%26psc%3D1,"₹1,774",,," Care Instructions: Wipe with Dry Cloth  
 High Quality: The synthetic leather laptop backpack for women and men is made of high-quality vegan leather material with superb craftsmanship and the clean design makes this backpack even more stylish.  
 Dimension: 13""L x 6""W x 18""H inch / Weight: 900 Gram..This unisex leather laptop backpack is comfortable, durable, and has enough storage space for all your daily use.Lightweight shoulder straps and back for comfortable wear, even during extended periods of use in college or office.  
 Roomy Capacity: This laptop backpack features multiple compartments. Including 2 main pocket, 1 computer laptop compartment and 1 cell phone pockets, 1 zippered pocket, 2 pen slots,1 trolley strap , types of pockets keep your belongings more organized.  
 Multipurpose: With the stylish and classic looking, this laptop backpack can suitable for school and college students for classes as well as a work backpack for business people. It is a great gift for your friend, wife, or colleague  
 After-Sale Service: We are committed to providing each customer with the highest standard of customer service and top quality goods, if you are not satisfied with our product or service for any reason, please feel free to contact us by email.  
",,"THE HUTCH ENTERPRISES, THE HUTCH ENTERPRISES D 27 NOIDA SECTOR 7 NOIDA (Emailid- thehutchenterprises27@gmail.com)",B0C594SZQ7
