"uppercase Medium 17 Ltrs Vegan Leather (upto 14 inch) Laptop Backpack 2300EBP1 3x more water resistant sustainable bags with rain proof zippers for Men, Women, Boys and Girls, 750 Days warranty",https://www.amazon.in//sspa/click?ie=UTF8&spc=MTo4Njk2NjcxNjkzNzM3NTk3OjE2OTI2NDE5ODM6c3BfYXRmOjIwMDYzNzg0NDU4Mzk4OjowOjo&url=%2Fuppercase-Backpack-2300EBP1-repellent-sustainable%2Fdp%2FB0B69M182Q%2Fref%3Dsr_1_1_sspa%3Fkeywords%3Dbags%26qid%3D1692641983%26sprefix%3D%252Caps%252C415%26sr%3D8-1-spons%26sp_csd%3Dd2lkZ2V0TmFtZT1zcF9hdGY%26psc%3D1,"₹1,600",4.0 out of 5 stars,540," Care Instructions: Hand Wash Only  
 Handcrafted with care and made up of premium quality robust material  
",,"Acefour Accessories Pvt. Ltd., Acefour Accessories Pvt. Ltd. , Lodha Supremus Corp. Tower, Unit 1202,12th Floor,Saki Vihar road, Chandivali, Tunga Village, Opp. MTNL office, Andheri E, Mumbai -400072, Maharashtra, India. Customer Care Email  customercare@uppercase.co.in & Contact no. +91 8691 800 800",B0B69M182Q
"Promate Akita-MB 16"" Laptop Messenger Bag, Premium Water-Resistant Shoulder Bag with Secure Quick Access Pocket, Detachable String and Anti-Theft Pocket for Laptops, Documents (Black)",https://www.amazon.in//sspa/click?ie=UTF8&spc=MTo4Njk2NjcxNjkzNzM3NTk3OjE2OTI2NDE5ODM6c3BfYXRmOjMwMDAzMTEyMzAzNDIzMjo6MDo6&url=%2FPromate-Messenger-Water-Resistant-Detachable-Anti-Theft%2Fdp%2FB07FDXXL2L%2Fref%3Dsr_1_2_sspa%3Fkeywords%3Dbags%26qid%3D1692641983%26sprefix%3D%252Caps%252C415%26sr%3D8-2-spons%26sp_csd%3Dd2lkZ2V0TmFtZT1zcF9hdGY%26psc%3D1,"₹1,999",5.0 out of 5 stars,5," The main padded compartment accommodates almost all laptops up to 16” screen.  
 External zipper pocket offers you with extra space to store items like power banks, cables, and more.  
 The Akita-MB messenger bag is made of high-quality material with superior quality inner lining.  
 The messenger bag is completely water-resistant so that you can take it out in any weather.  
 Carry all your essentials in this lightweight messenger bag for laptops & tablets up to 16” with multiple storage options.  
›
","Carry all your essentials in this lightweight messenger bag for laptops & tablets up to 16” with multiple storage options. Never worry about running out of space with this amazing lightweight messenger bag. Akita-MB features a superior quality inner lining. The well-padded adjustable sling adds on to the functionality. Moreover, Akita-MB is water-resistant, hence you need not worry about those accidental splashes. Carry this bag wherever you go.",,
Skybags Brat Black 46 Cms Casual Backpack,https://www.amazon.in//Skybags-Brat-Black-Casual-Backpack/dp/B08Z1HHHTD/ref=sr_1_3?keywords=bags&qid=1692641983&sprefix=%2Caps%2C415&sr=8-3,₹649,4.1 out of 5 stars,"5,523"," Care Instructions: Hand Wash Only  
 Combination of functional & safety features in stylish design, Soft mesh back with 8 mm foam padded 2 Main Compartment, 1 Slip In Pocket inside the bag, Printed Design, Mesh bottle holder on the side,  
 Water Resistance Level: Not Water Resistant  
 Size: 35 x 13 x 46 cms  
","Ideal for a college student who does not carry a lot of books or laptop to college. Very stylish, slim and feature loaded Backpack",VIP Industries Ltd,B08Z1HHHTD
American Tourister Fizz Large Size 32 Ltrs Casual Backpack (BLACK),https://www.amazon.in//American-Tourister-AMT-SCH-02/dp/B07CJCGM1M/ref=sr_1_4?keywords=bags&qid=1692641983&sprefix=%2Caps%2C415&sr=8-4,"₹1,199",4.0 out of 5 stars,"55,248"," Laptop Compatibility: No, Strap Type: Adjustable, Trolley Support: No. With Rain Cover : No  
 Outer Material: Polyester, Color: Black  
 Water Resistance: Water resistant , not Waterproof  
 Capacity: 32 liters; Dimensions: 31.5 x 22 x 49.5 Centimeters  
 Number of Wheels: 0, Number of compartments: 3  
 Warranty type: Manufacturer; 1 year International warranty valid for 1 year from the original date of  
 Mesh pockets on both sides to accommodate your sipper or bottle and umbrella  
 Mesh Padding on back & shoulder strap to provide comfort & better back support  
",,,
Half Moon Large 37L Laptop Bag Backpack for menं Women Boys and Girls Luggage Travel Bags with 17.3 inches Laptop Compartment & Rain Cover,https://www.amazon.in//Half-Moon-Backpack-Luggage-Compartment/dp/B09VCLZ3K4/ref=sr_1_5?keywords=bags&qid=1692641983&sprefix=%2Caps%2C415&sr=8-5,₹849,3.9 out of 5 stars,"3,442"," This lightweight and spacious laptop bag with 3 compartments contains a dedicated 360 degree protected laptop compartment (up to 17""), so you can you can transport your tech with peace of mind. A Spacious second compartment for essentials like books and files, and a third compartment for extra items. Also features padded shoulder straps and side pockets for water bottles.  
 Carry your books and belongings with ease with this comfortable and durable bagpack! Featuring wide, padded, and adjustable shoulder straps and a padded back, this backpack can handle even heavy loads. Made with strong yet lightweight polyester fabric and heavy-duty zippers, it's built to last. Plus, it comes with a rain cover, perfect for those rainy school or college days.  
 Make a statement on your next trip with our smart and stylish backpack! With a trendy and athletic design, this multipurpose backpack is the perfect combination of style and adventure. Your trips, travel experience cannot get completed without this amazing trekking backpack.  
 Experience enduring and long-lasting performance with our backpack! Made with highly durable material, this backpack is suitable for all weather conditions, including heavy rains and extreme heat. It not only keeps your belongings safe but also resists damage to itself. So, don't settle for anything less.  
 FEATURES: Rain Cover, upto 17 inch Laptop compartment, Internal Organiser(Small Pockets), Strong and durable zippers, Adjustable Shoulder Handles (Straps) , 2 Bottle/Umbrella holders , Padded Handle , Padded Laptop Compartment , Ergonomic Design, Reflector Logo, etc  
","This backpack is lightweight water-resistant, capacity of approx 37 Ltr, has a soft and ventilated back panel, and is perfect for carrying all your necessities. Adjustable and breathable padded shoulder strap to meet different requirements for both men and women; made from highly rip and water-resistant polyester fabric, provide strengthen and long-lasting performance; roomy enough for your traveling requirements also having a Rain cover.",Amazing Bags,B09VCLZ3K4
"FUR JADEN Anti Theft Number Lock Backpack Bag with 15.6 Inch Laptop Compartment, USB Charging Port & Organizer Pocket for Men Women Boys Girls",https://www.amazon.in//Number-Backpack-Compartment-Charging-Organizer/dp/B09VTDMRY7/ref=sr_1_6?keywords=bags&qid=1692641983&sprefix=%2Caps%2C415&sr=8-6,₹679,4.0 out of 5 stars,"5,603"," Care Instructions: Wipe with Damp Cloth  
 Number Lock: This Fur Jaden Anti Theft laptop backpack comes equipped with a Number Lock. This helps keep your laptop and other belongings safe when you need to leave your bag unattended in a public space. The number lock sequence can be changed and customised by your directly.<br>  
 USB Charging Port: Now charge your devices on the go with your new Fur Jaden backpack without the hassle of carrying a bulk power bank in your pocket/ hand at all times.<br>  
 Ergonomic Design: This backpack has been designed to ensure equal weight distribution on your shoulders along with padded shoulder straps and breathable air mesh on the back.<br>  
 Dimension: 42 CM (L) x 30 CM (W) x 18 CM (D). Storage Capacity: 25L. Weight: 600 Grams; Warranty: 1 Year Manufacturer Warranty against Manufacturing Defects<br>  
 Age Range Description: Adult; Closure Type: Zipper; Lining Description: Polyester<br>  
","Stay organized all day with a durable and lightweight backpack from Fur Jaden. This back pack is a stylish and functional accessory for men and women. Can add admiration to an appealing and daring personality with a remarkable aesthetics and functionality. This backpack features an anti-theft design. You can also charge your phone on the go and organize your stuff like pro. Fur Jaden functional back pack is apt to protect your gadgets and belongings from being stolen while you travel, thanks to its special anti-theft design. Now keep your belongings safe with style. The backpack features multiple compartments that you may use for your laptop and other essentials. A remarkable feature of this backpack allows you to charge your phone while you are on the move. With an attached charging dock in the back you may connect a portable power bank with ease. Weighing about 600grams, this backpack is lightweight. The backpack is able to house a laptop of up to 15.6 inches and has seven inner compartments to place your other essentials. Made from durable quality polymer this Fur Jaden back pack is sturdy and reliable. Flaunt this bag with style and low maintenance as this bag is washable. This backpack is also suitable for school or college. The straps are designed to distribute the weight equally on each shoulder preventing any sort of discomfort. Use this back pack for office, college/school or during travels.","FUR JADEN, Fur Jaden, 3C Jai Hind Bld, Dr AM Road, Bhuleshwar, Mumbai 400002",B09VTDMRY7
TRUE HUMAN EMPEROR® Anti-Theft backpack With USB charging Port Laptop bag/Office bag/college bag/travel bag with anti -theft back pocket (LEGEND),https://www.amazon.in//TRUE-HUMAN-Anti-Theft-backpack-charging/dp/B09QJ7ZF2Y/ref=sr_1_7?keywords=bags&qid=1692641983&sprefix=%2Caps%2C415&sr=8-7,₹599,3.7 out of 5 stars,"2,463"," Care Instructions: Hand Wash Only  
 Ease of Access-Multi purpose pockets Super sorted stuff It has a vibrant and stylish design, along with the added benefit of spacious interiors.  
 Anti - Theft Pocket-Hidden storage pocket for important documents like passports, tickets, cash while on the go.  
 Integrated Fast charging port-Unique pre-fitted USB port helps you to easily connect your phone or any other device with your power bank. Charging system for smart devices , with free USB (power bank not included )  
 Care Instructions: Wipe with Dry Cloth  
 Superior & Durability: Made of durable and Eco-friendly water resistant oxford textile fabric,which keeps your files and stuffs dry inside. This backpack can hold up to 15.6"" laptop from most brands, but it may not be suitable for all brand 15.6"". Since there maybe exist slight size difference among different laptop brands.  
",,,B09QJ7ZF2Y
"Half Moon 35 Ltrs Water Resistant 15.6 inch Laptop Bag for Men/Backpack for Men, Navy Blue | Office Bag for Men/Office Bag for Women with Padded Laptop Compartment | Rain Cover & Reflective Strips",https://www.amazon.in//Half-Moon-Waterproof-Backpack-Students/dp/B085MHDJ93/ref=sr_1_8?keywords=bags&qid=1692641983&sprefix=%2Caps%2C415&sr=8-8,₹649,3.9 out of 5 stars,"16,960"," Care Instructions: Hand Wash Only  
 SPACIOUS AND LIGHTWEIGHT: Light weight & spacious laptop bag for men comes with 3 compartments. One is for carrying laptop inside (Upto 17""), with padding for safety, and space for laptop accessories like charger, etc. Second compartment of office bag for men is for books, files & all your day to day essentials. And third compartment of backpack for men is for your extra stuff. Laptop backpacks for men has provision for holding bottles on both sides & has padded shoulder straps for your comfort  
 COMFORT WITH QUALITY: This backpack for men has Wide, Padded & Adjustable shoulder straps & Padded Back for comfort in carrying heavy items. The laptop bag for men is stitched properly & Bartacks on every pressure point for extra durability. The office bag for men are made with strong yet light weight polyester fabric with heavy zippers. College Bags for men also comes with a Rain cover so that you can travel during rainy season without any problem. This laptop bag can be used by everyone.  
 SMART & TRENDY LOOKS: This Large backpack for men is smart, trendy and stylish in looks. The multipurpose college bags for men looks smart, athletic and venturesome and the blend of grey and red makes it appear exquisite. Your hiking trips, mountaineering experience cannot get completed without this amazing trekking backpack. PREMIUM FABRIC : Premium Polyester, Stylish and durable backpack for school /college and travel. Easily accommodate a laptop. Size: 45 cm X 31 cm X 22 cm  
 ENDURING & LONG LASTING LAPTOP BACKPACK: This trekking backpack for men/laptop bag for men is made up of highly durable material, which makes it suitable for all weather conditions including rains & extreme scorching heat. It will not only keep the inside stuff safe but will also resist damage to itself. We have designed the bag keeping your comfort in mind. Shoulder has high density padding, with 3D ventilated air foam padding to prevent sweating & to help you lift heavy objects easily.  
 OTHER FEATURES OF LAPTOP BAG FOR MEN: The office bag for men / office bag for women has Strong and durable zippers, Adjustable Shoulder Handles (Straps) , 2 Bottle/Umbrella holders , Padded Handle , Padded Laptop Compartment (can carry laptops of size 13, 14, 15.6 & 17 inches), Reflector Logo.  
",,"Amazing Bags, Half_Moon, New Delhi",B085MHDJ93
Half Moon Large 37L Laptop Bag Backpack for menं Women Boys and Girls Luggage Travel Bags with 17.3 inches Laptop Compartment & Rain Cover,https://www.amazon.in//Half-Moon-Resistant-Backpack-Compartment/dp/B0BJ32LQ6X/ref=sr_1_9?keywords=bags&qid=1692641983&sprefix=%2Caps%2C415&sr=8-9,₹849,3.9 out of 5 stars,"3,442"," Care Instructions: Hand Wash Only  
 This lightweight and spacious laptop bag with 3 compartments contains a dedicated 360 degree protected laptop compartment (up to 17""), so you can you can transport your tech with peace of mind. A Spacious second compartment for essentials like books and files, and a third compartment for extra items. Also features padded shoulder straps and side pockets for water bottles.  
 Carry your books and belongings with ease with this comfortable and durable bagpack! Featuring wide, padded, and adjustable shoulder straps and a padded back, this backpack can handle even heavy loads. Made with strong yet lightweight polyester fabric and heavy-duty zippers, it's built to last. Plus, it comes with a rain cover, perfect for those rainy school or college days.  
 Make a statement on your next trip with our smart and stylish backpack! With a trendy and athletic design, this multipurpose backpack is the perfect combination of style and adventure. Your trips, travel experience cannot get completed without this amazing trekking backpack.  
 Experience enduring and long-lasting performance with our backpack! Made with highly durable material, this backpack is suitable for all weather conditions, including heavy rains and extreme heat. It not only keeps your belongings safe but also resists damage to itself. So, don't settle for anything less.  
 FEATURES: Rain Cover, upto 17 inch Laptop compartment, Internal Organiser(Small Pockets), Strong and durable zippers, Adjustable Shoulder Handles (Straps) , 2 Bottle/Umbrella holders , Padded Handle , Padded Laptop Compartment , Ergonomic Design, Reflector Logo, etc  
","This backpack is lightweight water-resistant, capacity of approx 37 Ltr, has a soft and ventilated back panel, and is perfect for carrying all your necessities. Adjustable and breathable padded shoulder strap to meet different requirements for both men and women; made from highly rip and water-resistant polyester fabric, provide strengthen and long-lasting performance; roomy enough for your traveling requirements also having a Rain cover.",Amazing Bags,B0BJ32LQ6X
"Fur Jaden 55 LTR Rucksack Travel Backpack Bag for Trekking, Hiking with Shoe Compartment",https://www.amazon.in//Rucksack-Travel-Backpack-Trekking-Compartment/dp/B07YDGQQN5/ref=sr_1_10?keywords=bags&qid=1692641983&sprefix=%2Caps%2C415&sr=8-10,₹849,4.3 out of 5 stars,"5,600"," Large sized black and grey colour trekking rucksack for men and women for travel use as well as for trendy college and school students. Huge compartment size that can fit upto several pairs of clothes with ease with separate pocket for shoesMultiple pockets for other accessories and water bottle<br>  
 External clips to hold a yoga mat on the backside available with this rucksack. Also available on both sides of the rucksack are additional clips which can be used to carry camera stands as well as other climbing equipments<br>  
 The rucksack features a sleek and ergonomic design with a balanced weight distribution through its shoulder straps and waist strapsThis makes this product a suitable alternative to bulky and unsightly rucksacksThe compact design of this trekking bag helps you to rest it comfortably on your shoulders while accommodating all your essentials with ease<br>  
 Capacity: 55 L ; weight: 700 grams; dimensions: 35 cms x 25 cms x 65 cms (LxWxH); 1 Year manufacturer warranty against defects; Lining Description: Polyester; Special Features: Back Padding; Pocket Description: Utility Pocket; Style Name: Rucksack Backpacks; Closure Type: Zipper; Age Range Description: Adult; Color Name: Black Grey<br>  
 Water Resistance Level: Water Resistant; Warranty Description: 1 Year Manufacturer Warranty Against Defects Only<br>  
",,"Fur Jaden, Fur Jaden 3-C, Jai Hind Bld, Dr AM Road, Bhuleshwar, Mumbai 400002, 8080888028",B07YDGQQN5
"HOEXL 42L Expandable Laptop Backpack - Premium Laptop Backpacks for Men, Women for Travel, School, College - Tech Bag with USB - Bagpacker Bag for Men, 17 inch Laptop Bags for Multipurpose with Water-resistant, Smart Bag with Multiple Compartments",https://www.amazon.in//sspa/click?ie=UTF8&spc=MTo4Njk2NjcxNjkzNzM3NTk3OjE2OTI2NDE5ODM6c3BfbXRmOjMwMDAxMjMzOTQzMjgzMjo6MDo6&url=%2FHOEXL-Expandable-Laptop-Backpack-Water-resistant%2Fdp%2FB0C3J2RLHP%2Fref%3Dsr_1_11_sspa%3Fkeywords%3Dbags%26qid%3D1692641983%26sprefix%3D%252Caps%252C415%26sr%3D8-11-spons%26sp_csd%3Dd2lkZ2V0TmFtZT1zcF9tdGY%26psc%3D1,"₹2,699",5.0 out of 5 stars,33," Care Instructions: Hand Wash Only  
 The Ultimate Expandable HOEXL Backpack - Unlock the limitless potential of our HOEXL backpack. With its ingenious expandable feature, effortlessly transition from 25 Litre to a generous 42 Litre capacity. Adapt to any situation, whether it's daily commuting or weekend getaways, and carry more with ease. It comes with 100% guarantee and 2 year HOEXL trust warranty.  
 Convertible HOEXL Travel Backpack - This versatile backpack offers three modes - shoulder mode, office mode, and luggage or suitcase mode - providing you with the ultimate convenience for any situation. Carry it comfortably on your shoulder, effortlessly transition to a sleek office bag, or convert it into a spacious luggage for your traveling needs. With its stylish design, durable construction, and ample storage space, this back pack is the epitome of versatility  
 Multiple Compartments for Better Storage - your ultimate companion for organized and efficient travel. With three dedicated compartments, this backpack offers ample storage for your personal belongings, clothing, and electronic devices. Safely store your laptop and computer in separate compartments while keeping pens, phone and accessories organized in convenient pockets. This is designed to streamline your life and keep all your essentials within reach.  
 USB Port Backpack - This innovative backpack features a built-in USB port, allowing you to conveniently charge your devices while on the move. Simply connect your charger to the internal cable and stay powered up throughout your day. With its spacious compartments and comfortable design, this backpack is perfect for carrying your essentials and keeping your devices charged wherever you go.  
 Water-Resistant Laptop Backpack - A durable and reliable companion for all your adventures. Crafted with high-quality oxford materials, this backpack is built to withstand the elements and protect your belongings from water damage. Its rugged construction ensures long-lasting durability, making it perfect for daily use and outdoor activities. With its spacious compartments and ergonomic design, this backpack provides ample storage and comfortable carrying.  
",,"HOEXL, SSRN Enterprises",B0C3J2RLHP
"uppercase 26 Ltrs Ryder Professional Laptop Backpack (15.6 Inch) 3x more water resistant sustainable bags with rain proof zippers for Men, Women, Boys and Girls, 750 Days warranty",https://www.amazon.in//sspa/click?ie=UTF8&spc=MTo4Njk2NjcxNjkzNzM3NTk3OjE2OTI2NDE5ODM6c3BfbXRmOjIwMTI3NjgzODcyMzk4OjowOjo&url=%2FUPPERCASE-Professional-Backpack-resistant-sustainable%2Fdp%2FB0BXFDK5J2%2Fref%3Dsr_1_12_sspa%3Fkeywords%3Dbags%26qid%3D1692641983%26sprefix%3D%252Caps%252C415%26sr%3D8-12-spons%26sp_csd%3Dd2lkZ2V0TmFtZT1zcF9tdGY%26psc%3D1,"₹2,400",4.3 out of 5 stars,78," Care Instructions: Wipe with Damp Cloth  
 Handcrafted with care and made up of premium quality robust material  
 GRS certified for sustainability; The GRS (Global Recycled Standard) is intended for use with any product that contains at least 50% Recycled Material (License No. CMPY-158596); 750 days of international warranty  
 Padded laptop compartment fits up to 15.6"" Laptop, Tablet Sleeve; Back padding with Air mesh; Front access pocket for you to easily carry important small items with a bottle holder on the side  
 Wrinkle free bag and 3x more water resistant with Rainproof zippers; Trolley sleeve to securely place the bags on the luggage; Top Gadget Pocket; Internal Organiser  
",,"Acefour Accessories Pvt. Ltd., Acefour Accessories Pvt. Ltd. , Lodha Supremus Corp. Tower, Unit 1202,12th Floor,Saki Vihar road, Chandivali, Tunga Village, Opp. MTNL office, Andheri E, Mumbai -400072, Maharashtra, India. Customer Care Email  customercare@uppercase.co.in & Contact no. +91 8691 800 800",B0BXFDK5J2
POLICE Backpack for Men Casual Laptop Bag Office/Travel/College 30 Ltr Hedge Polyester - Black,https://www.amazon.in//Police-Polyester-laptop-casual-backpack/dp/B09CQ5T3LN/ref=sr_1_13?keywords=bags&qid=1692641983&sprefix=%2Caps%2C415&sr=8-13,"₹1,399",4.1 out of 5 stars,"5,852"," Care Instructions: Hand Wash Only  
",Backpack,,B09CQ5T3LN
Fur Jaden Brown Textured Leatherette Stylish & Spacious Weekender Duffle Bag for Travel,https://www.amazon.in//FUR-JADEN-Leatherette-Polypropylene-DUFF05/dp/B07M9BRCQ5/ref=sr_1_14?keywords=bags&qid=1692641983&sprefix=%2Caps%2C415&sr=8-14,₹899,4.3 out of 5 stars,"6,505"," MATERIAL - We use of Artificial Leather which is Durable, Long Lasting and tested to ensure they don't peel off in just few months. The leather is also water resistant. Inner fabric lining ensured to have a soft touch feel. We use quality zips and accessories that have a long life.  
 Waterproof - With this unisex duffle bag, you can be rest assured that none of your belongings will be damaged by rain or accidental splashes. The interiors of this water-resistant travel duffle bag remain free from moisture even if you get caught in an unexpected shower.  
 Dimensions: 47 x 28 x 27 CM. Volume Capacity - 35 Litres. Huge Spacious Compartment  
 Design - This stylish yet utilitarian textured leatherette duffle bag can be used for corporate travel as well as to take to the gym. The Large Spacious Compartment is suitable for 3-4 days weekender or business trip, can be used as a carry-on flight bag as well.  
 Warranty - Fur Jaden Men Bags, 10 days No Question asked replacement guarantee from the date of delivery. 6 Month Manufacturer and Seller Warranty against Manufacturing Defects  
 Warranty - 100% Genuine Fur Jaden Men Bags, 10 days No Question asked replacement guarantee from the date of delivery. 6 Month Manufacturer and Seller Warranty against Manufacturing Defects  
",Fur Jaden Brown Textured Leatherette Stylish & Spacious Weekender Duffle Bag for Travel,"Fur Jaden, 3-C, Jai Hind Bld, Dr AM Road, Bhuleshwar, Mumbai 400002, 8080888028",B07M9BRCQ5
Gear CarryOn 16L Foldable Water Resistant School Bag//Backpack/College Bag for Men/Women - Blue Black,https://www.amazon.in//GEAR-Black-Blue-Backpack-years/dp/B019HA8AYG/ref=sr_1_15?keywords=bags&qid=1692641983&sprefix=%2Caps%2C415&sr=8-15,₹199,3.7 out of 5 stars,"7,050"," Outer Material: Polyester, Color: Black and Yellow.Ideal for 3-5 year old children.  
 Wear Resistant: Wear resistant, Stain resistant, Water Resistance: Water resistant; Dimensions: 49 cms x 33 cms x 10 cms (LxWxH)  
 Number of compartments: 1; Compatible Laptop Size : 15.4  
 Warranty Type: Manufacturer; 1 Year from the date of purchase  
 Pocket Description: Utility Pocket; Color Name: Black And Blue; Age Range Description: Adult; Closure Type: Zipper  
",,"Gear Merchandise PVT LTD, Gear Merchandise PVT LTD E/12 West Chowbaga Gulshan colony KoLkata-700100 Contact 9830403366",B019HA8AYG
