WildHorn Leather Laptop Bag for Men I Fits Upto 15.6 Inch Laptop/MacBook I Padded Laptop Compartment I Carry Handles with Adjustable Strap I DIMENSION : L-16 inch W-4 inch H-12 inch,https://www.amazon.in//WildHorn-Leather-Laptop-Messenger-Dimension/dp/B079HQKSZN/ref=sr_1_214?keywords=bags&qid=1692643113&sprefix=%2Caps%2C415&sr=8-214,"₹2,629",4.2 out of 5 stars,(973)," 1.GENUINE LEATHER: If you love leather, timeless design, fashionable and durable bags, you'll surely love WILDHORN'S Leather Bags.Crafted from leather this bag is meticulously crafted into a adorable, durable & classic masterpiece by highly skilled professionals.Perfect for office, meeting, working, travelling and other occasions.  
 2.FUNCTIONAL & STYLISH: Functional design makes it spacious enough to carry all your daily essentials.It has 2 Main Compartments with dedicated padded compartment for laptop,1 mega front pocket with flap closure,2 vertical zips on front,1 zip compartment on back side, 1 zip around sides of bag ,2 Carry Handles with adjustable strap. Dimension: L-16 inch W-4 inch H-12 inch  
 3.ART OF CRAFTSMANSHIP:Designed by highly trained designers with latest trend analysis. This bag reflects a perfect balance between utility,design and convenience.The most distinguishing feature of this product is that the leather may have wrinkles,scratches,shade,grain and natural markings that are enherent characteristics and reflect the natural beauty of the hide.  
 4.PERFECT COMPANION : This bag is preferable for all age groups and can be carried on all occasions. A Perfect companion whether it be a Student,Workaholic/Shopaholic or Traveller,this bag serves all purpose-need. This perfect bag is designed for all-day comfort and can be a perfect present for Men. Father's day, Anniversary,Graduation Day,Friendship Day or birthday, this elegant bag is a great gift idea for Men.  
 5.NOTE : Product colour may slightly vary due to photographic lighting sources or your monitor settings. This bag has been made out of leather with durable lining, trims and it’s a natural thing where colour variation is never under control.  
",,"ADL International, ADL International, 61/H G.J.Khan Road, Topsia, Kolkata-700039",B079HQKSZN
BEST DEAL 25 ltrs (5 Cms) backpack(AASHISHIMPEXGREY_grey),https://www.amazon.in//BEST-DEAL-Womens-Backpack-College/dp/B08FYRN2SL/ref=sr_1_215?keywords=bags&qid=1692643113&sprefix=%2Caps%2C415&sr=8-215,₹334,3.6 out of 5 stars,(894)," <br>Material Type - Canvas</br><br> <br>  
 <br>Colour - Grey</br><br> <br>  
 <br>For Women</br><br> <br>  
 Age Range Description: Adult; Pattern Name: Solid; Water Resistance Level: Waterproof; Special Features: Back Padding; Lining Description: Polyester; Color Name: Light Grey; Closure Type: Zipper; Warranty Description: Manufacturer-Aashish Impex,Delhi; Material Type: Polyester; Strap Type: Shoulder Strap <br>  
","It is compact to store your important things with ease.Made From outer material Poleyster and inner material From Fabric. Furthermore, they feature Zip closure are best suited for a casual and partywear occasion, Creativity and Ambition fueled the rise of .This is the most stylish work/laptop bag you could own to stay well-equipped because of the spacious inner. With this bag, you are sure to make heads turn at your work place because of the unique bag style and vibrant color. Carry your office gear-files, papers, gadget and other requirements easily in this meticulously designed tote bag . The eye-catchy houndstooth print at the sides adds to the overall design of the bag. Girls, carry your whole world in this classy cum convenient shoulder bag.. Suitable for any occasion with casual and simple design like business, working,traveling, party, etc. Perfect gift choice.","Panwar Bags,Delhi-110094, Aashish Impex,Delhi",B08FYRN2SL
ADISA Laptop Backpack 31 Ltrs,https://www.amazon.in//ADISA-BP004-Weight-Casual-Backpack/dp/B07G3F1G7T/ref=sr_1_216?keywords=bags&qid=1692643113&sprefix=%2Caps%2C415&sr=8-216,₹399,4.0 out of 5 stars,(9K+)," Adjustable Shoulder Handles / Two Bottle holders / Padded Top Handle / Reflector Logo  
 NOT INCLUDED : Raincover, Headphones & Cable (Images only for display)  
 Laptop Size : 15.6 inches and below (Bigger than 15.6 inches not recommended)  
 Compartments : 2 with full padding; Front Easy Access Pocket  
 Dimensions : LxWxH- 12 x 7 x 18 inches  
",,"ADISA, ADISA INTERNATIONAL, 42/34, Upper Ground Floor, DLF Industrial Area, Kirti Nagar, New Delhi 110015, careadisa@gmail.com",B07G3F1G7T
"STRAUSS Yoga Mat Bag Cover with Shoulder Strap with Pocket for Men & Women, Drawstring and Full Zip,(Multicolor)",https://www.amazon.in//STRAUSS-Jute-Yoga-Shoulder-Strap/dp/B0BBWM221J/ref=sr_1_217?keywords=bags&qid=1692643113&sprefix=%2Caps%2C415&sr=8-217,₹219,3.6 out of 5 stars,(760)," High Quality Jute and Cotton Fabric and this bag is a luxurious and perfect for yoga and Pilates. Size 62 cm, 16 cm Diameter. Standard size Mat can hold.  
 This bag is perfect size for Yoga Mats, Props & Accessoress carrying to yoga classes and store in your house.  
 This bag can accommodate, Bigger Mat, Yoga Blocks, Blanket, Eye Pillow, Yoga Strap and your personal belonging like purse, Mobile, key's.  
 carrying strap provided makes it convenient to put the mat inside the bag  
 High quality drawstring rope for closure, PROUDLY MADE IN INDIA.  
",,,
"STRABO Cooper for Boys Girls Stylish Men and Women Casual 15"" inch 25L CANVAS Laptop BACKPACK | Office, College, Travel Bag",https://www.amazon.in//STRABO-Cooper-Laptop-Bag-Capacity/dp/B0BX9V66C9/ref=sr_1_218?keywords=bags&qid=1692643113&sprefix=%2Caps%2C415&sr=8-218,₹699,4.3 out of 5 stars,(67)," Care Instructions: Hand Wash Only  
 One Main compartment and Laptop Compartment with front pocket & 2 side bottle sleeves  
 Dimensions 45 x 32 x 17 cm  
 Capacity 20L  
 Premium YKK zippers  
","Strabo Cooper is a classy Laptop Backpack, ergonomically designed for all ages, genders and purposes which houses everything in one large compartments & one exterior pocket.This backpack is especially designed for today's fast paced world,where everything should be compact and lightweight. This backpack is perfect for everyday usage such as college, school, tuitions, or short holiday trips.",STRABO BAGS AND ACCESSORIES LLP,B0BX9V66C9
"Half Moon Vision Water Resistant 15.6 inch Laptop Bag for Men/Backpack for Men, Blue | Office Bag for Men/Office Bag for Women with Padded Laptop Compartment | (Navy and Black)",https://www.amazon.in//sspa/click?ie=UTF8&spc=MTo2MDczMTM2OTMwNTIyNTk3OjE2OTI2NDMxMTM6c3BfbXRmOjIwMTQ1ODQ1MTQ2Nzk4OjowOjo&url=%2FHalf-Moon-Resistant-Backpack-Compartment%2Fdp%2FB0BYW5SH4L%2Fref%3Dsr_1_219_sspa%3Fkeywords%3Dbags%26qid%3D1692643113%26sprefix%3D%252Caps%252C415%26sr%3D8-219-spons%26sp_csd%3Dd2lkZ2V0TmFtZT1zcF9tdGY%26psc%3D1,₹599,4.7 out of 5 stars,(14)," Care Instructions: Hand Wash Only  
 Compatible With 15.6"""" Laptop : This Half Moon Vision laptop bag for men fits up to 15.6 inch laptop. Dimensions of office bag for men: 34cm x 15cm x 45.5cm; Weight: 453g.  
 High Quality, Durable and Water Repellent Fabric : This office bag for men / office bag for women features in durable snow yarn polyester fabric and streamlined design with a padded interior to protect notebooks and important items.  
 Convenient Travel : The Laptop backpack for men has an adjustable shoulder strap and padded laptop compartment together with a quilted back panel make it comfortable for all-day use.  
 Conveniently Placed Padded Laptop Compartments and Packets : The laptop bag for men has an padded interior that helps protect notebooks and important items. Quick access zippered front pocket for added storage. The laptop backpack for men has a quilted back panel which makes it comfortable for all-day use.  
 High Quality, Casual yet Stylish Design : The laptop bag for men is very attractive and perfect for school, travel and outdoor activities. The perfect office bag for men / office bag for women for those needing stylish all-day protection for their laptop.  
",,Half_Moon,B0BYW5SH4L
FUR JADEN Pro Series Smart Tech Anti-Theft Laptop Backpack With USB-A and USB-C Type Charging Port for Men & Women For Business Professionals & College Students,https://www.amazon.in//sspa/click?ie=UTF8&spc=MTo2MDczMTM2OTMwNTIyNTk3OjE2OTI2NDMxMTM6c3BfbXRmOjIwMTUzOTYyNDIxNTk4OjowOjo&url=%2FFUR-JADEN-Anti-Theft-Backpack-Professionals%2Fdp%2FB0C28K6JBP%2Fref%3Dsr_1_220_sspa%3Fkeywords%3Dbags%26qid%3D1692643113%26sprefix%3D%252Caps%252C415%26sr%3D8-220-spons%26sp_csd%3Dd2lkZ2V0TmFtZT1zcF9tdGY%26psc%3D1,"₹3,499",4.6 out of 5 stars,(99)," Care Instructions: Wipe with Damp Cloth  
 Fur Jaden Pro Series: Introducing our most premium, stylish and functional range of travel accessories. We craft signature pieces that are young, vibrant and fashionable, and yet a celebration of timeless style, luxe and sophistication.  
 Smart Anti-Theft Tech Backpack: Fur Jaden Pro V comes with an in-built USB Type-A and USB Type-C reversible charging port system to facilitiate safe and quick charging on the go. With reversible charging, charge the powerbank directly without having to remove it from your bag. Anti-Theft: This smart tech backpack comes with an anti-theft pocket on the back to store valuable documents, wallets, keys and other smaller essentials while travelling.  
 Multi Utility Compartments: Unique Barrel styled front compartment is spacious to house t-shirts and denims for a short weekend getaway. It also features a small utility pocket to hold wallets/ cardholders/keys. On the back, a 180 Degree openable padded compartment to store tablets/ kindle devices and laptops upto 15.6 Inches.  
 Innovative Design: Handcrafted with precision, this uniqely designed structured laptop backpack features two quick access front pockets to hold small accessories plus an additional side pocket to house the power bank which can also be used to store a 500ml water bottle.  
 Warranty: 1 Year Manufacturer Warranty Against Defects. Product Dimensions: 48 cm (H) x 30 cm (W) x 15 cm (D). Storage Volume: 22L.  
","Stay organized all day with Fur Jaden's durable and lightweight pro series backpack. This smart tech laptop backpack is a stylish and functional accessory for men and women. It adds admiration to an appealing and daring personality with remarkable aesthetics and functionality. It comes with a utility pocket in the main compartment which helps keep smaller accessories and belongings in place. Fur Jaden's Pro Series functional backpacks are apt for professionals looking to stay connected to their devices all day long as it features a smart in-built USB Type-A and USB Type-C charging port station which also supports reversible charging. This smart backpack also features an anti-theft pocket on the back to protect your gadgets and belongings from being stolen while you travel, now keep your belongings safe with style. The backpack features a 180 Degree openable padded gadget compartment that you may use to store your laptop and tablets safely. Weighing about 900 grams, this backpack is lightweight and easy to carry all day long. This tech backpack from Fur Jaden is able to house laptops of up to 15.6 inches and has several pockets to place mobile phones, pens, power banks, etc. Made from premium & durable quality PU, Fur Jaden Pro Series backpacks are sturdy and reliable. Flaunt this uniquely designed handcrafted Fur Jaden bag with style as it helps elevate your style quotient. This backpack is suitable for working professionals and uber cool college students . The straps are designed to distribute weight equally on each shoulder preventing any sort of discomfort. This stylish laptop backpack comes with a convenient grab handle which not only adds convenience but also helps grab a lot of attention.","Fur Jaden, Fur Jaden, 3C Jai Hind Bld, Dr AM Road, Bhuleshwar, Mumbai 400002",B0C28K6JBP
"Chic Buddy Waterproof Wet Bag, Washable, Reusable for Travel, Beach, Pool, Stroller, Diapers, Dirty Gym Clothes, Wet Swimsuits, Toiletries",https://www.amazon.in//Chic-Buddy-Waterproof-Swimsuits-Toiletries/dp/B09KSBHC18/ref=sr_1_221?keywords=bags&qid=1692643113&sprefix=%2Caps%2C415&sr=8-221,₹309,4.4 out of 5 stars,(400)," About this item 
About this item
 Convenient – Our wet bags are great for carrying diapers, dirty gym clothes and wet swimsuits; not just for wet stuff - these bags make excellent organizers for toys, accessories, toiletries, electronics, travel and more  
 Reuse And Reduce Waste – The better alternative to single-use plastic bags, our bags are made of Chic Buddys' original waterproof fabric that’s both soft and strong (although fabric is waterproof, bags are not completely leakproof due to zippered closure)  
 Waterproof – Chic Buddys’ original fabric is 100% polyester with embedded TPU for waterproofing and our heat-sealed seams keep the mess where it belongs - inside the bag  
 Lots Of Uses – Not just for wet stuff - these bags make excellent organizers for toys, accessories, toiletries, electronics, travel and more! With a snap handle, snap your bag wherever you need it - stroller, changing table or suitcase  
 Easy-To-Clean – Wipe small messes; hand-wash or machine wash; to extend the life of fabric, we do recommend hang drying our quick-dry fabric; always ensure fabric is completely dry before storing  
",,,B09KSBHC18
Safari Arc Polyester 55 Cms 2 Wheel Travel Duffel Bag (Red),https://www.amazon.in//Safari-Duffle-Travel-Luggage-Trolley/dp/B097JJXL9K/ref=sr_1_222?keywords=bags&qid=1692643113&sprefix=%2Caps%2C415&sr=8-222,"₹1,309",3.8 out of 5 stars,(399)," HIGH QUALITY FABRIC: Our lightweight yet durable luggage duffel bag are made of 100% polyester. This spacious travel bag for men and women  can be used for road trip, short tour.  
 CAPACITY: (40 liters; Weight: 1900 grams; Dimensions: 26 cms x 31 cms x 55 cms (LxWxH)). Our fancy double compartment spacious bags help you organize your stuff and makes your travelling comfortable  
 FRONT POCKET: Our trendy unisex bag  has a large front storage pocket that helps you organise your stuff neatly and easy to access  
 Features: Polyester fabric, Trolley with 2 wheels, Shoulder strap, Cushion handle and Side pocket Our smooth maneuverable two wheel travel bag gives you a feel of trolley bag and has a extendable handle to make strolling easy for you  
 WARRANTY: All of our bags are made in India come with 1-year International Warranty against manufacturing defects  
",Our high quality durable products sets our Duffel Bags apart. This travel bag is surely one of the most stylish and trendy looking duffels you can get your hands on. This bag offers a massive 40 litre of storage. This multi purpose bag comes with a front pocket which helps you to organise your stuff in a systematic way. Our product is great as a carry-on companion with extendable handle and double compartment to make travel easy and comfortable for you.,"Safari, 302-303, A Wing, The Qube CTS No.1498, A/2, Sir Mathuradas Vasanji Rd, Marol, Andheri East, Mumbai, Maharashtra 400059",B097JJXL9K
Dyazo Slim 15.6 inch Laptop Backpack Business Notebook computer bag suitable for office College School Men & Women,https://www.amazon.in//Dyazo-Backpack-Business-Notebook-computer/dp/B0C7HC675G/ref=sr_1_223?keywords=bags&qid=1692643113&sprefix=%2Caps%2C415&sr=8-223,₹599,4.5 out of 5 stars,(8)," Specification : Color Grey & Black Dimensions 45inch * 37 Inc *13 "" Total Capacity 22 Liters Material Oxford Khadi Fabric  
 Dyazo Notebook Bag Is A Slim Laptop Bag But Comes With Dedicated Laptop Compartment Which Can Hold 15.6 Inch Laptop As Well As Smaller 15 Inch,14 Inch And 13 Inch Laptop And Its Charger With Some Files Notebook I Pads And One Front Compartment Good To Store Your Daily Necessities , Such As Pen Power Bank Ear  
 Dyazo Laptop Bag Comes With A Luggage Strap That Enables Your Laptop Bag To Fit On Your Suitcase Slide Over The Luggage Handle Tube For Easier Carrying While Travelling On The Go .  
 CONVENIENT STORAGE Laptop Backpacks Comes With A Side Net Pocket Makes It Easy To Hold A Water Bottle .  
›
","DURABLE & COMFORTABLE Oxford Fabric Thanks to dyazo slim backpack Water-Resistant And Scratch-Resistant fabric Offers Long Life And Can Be Used As A Daily Backpack, Work Backpack or A Study Bookbag, Sutable As A Business Laptop Backpack For Men Women Adult Teens Or Daily Use Anywhere",,
LOOKMUSTER Casual Waterproof Laptop Backpack/Office Bag/School Bag/College Bag/Business Bag/Travel Backpack…,https://www.amazon.in//LOOKMUSTER-Waterproof-Backpack-College-Business/dp/B0BS6YGKMC/ref=sr_1_224?keywords=bags&qid=1692643113&sprefix=%2Caps%2C415&sr=8-224,₹614,3.9 out of 5 stars,(44)," Care Instructions: Dry Clean Only  
 30L Capacity: The Backpack has a padded laptop compartment that can fit 15.6 inch laptop. It can also accommodate essentials such as a Lunch box, Charger, Tablet, Books, Power Bank, Wallet, and Sunglass.  
 Multi-Level Organizer: The backpack has a front zipper pocket for the ID card, Sanitizer, House keys, Pen. First compartment with pockets for the earphones, pens, notebook, Fitness Band. Spacious second compartment for all your electronics. Compatible Laptop Size 16 inch  
 Ergonomic Design: Thick cushioning around the shoulders and on the back panel makes the backpack super light and comfortable on the move. “S” Shaped shoulder strap distribute the weight of the backpack across your upper body.  
 Made In India: Lookmuster Business Casual Backpack is fully manufactured in India and pass through stringent quality tests and checks  
 Water Resistant Material: Advanced IPX4 coating on the material ensures resistance to water entering from any direction.  
",,"Lookmuster, B-3/406 Agar nagar PremNagar-3rd Kirari suleman Nagar New Delhi-110086,Contact9643638187.Lookmuster@gmail.com",B0BS6YGKMC
Half Moon Large 37L Laptop Bag Backpack for menं Women Boys and Girls Luggage Travel Bags with 17.3 inches Laptop Compartment & Rain Cover,https://www.amazon.in//Half-Moon-Resistant-Backpack-Compartment/dp/B0BHX7GY16/ref=sr_1_225?keywords=bags&qid=1692643113&sprefix=%2Caps%2C415&sr=8-225,₹849,3.9 out of 5 stars,(3.4K+)," This lightweight and spacious laptop bag with 3 compartments contains a dedicated 360 degree protected laptop compartment (up to 17""), so you can you can transport your tech with peace of mind. A Spacious second compartment for essentials like books and files, and a third compartment for extra items. Also features padded shoulder straps and side pockets for water bottles.  
 Carry your books and belongings with ease with this comfortable and durable bagpack! Featuring wide, padded, and adjustable shoulder straps and a padded back, this backpack can handle even heavy loads. Made with strong yet lightweight polyester fabric and heavy-duty zippers, it's built to last. Plus, it comes with a rain cover, perfect for those rainy school or college days.  
 Make a statement on your next trip with our smart and stylish backpack! With a trendy and athletic design, this multipurpose backpack is the perfect combination of style and adventure. Your trips, travel experience cannot get completed without this amazing trekking backpack.  
 Experience enduring and long-lasting performance with our backpack! Made with highly durable material, this backpack is suitable for all weather conditions, including heavy rains and extreme heat. It not only keeps your belongings safe but also resists damage to itself. So, don't settle for anything less.  
 FEATURES: Rain Cover, upto 17 inch Laptop compartment, Internal Organiser(Small Pockets), Strong and durable zippers, Adjustable Shoulder Handles (Straps) , 2 Bottle/Umbrella holders , Padded Handle , Padded Laptop Compartment , Ergonomic Design, Reflector Logo, etc  
","This backpack is lightweight water-resistant, capacity of approx 37 Ltr, has a soft and ventilated back panel, and is perfect for carrying all your necessities. Adjustable and breathable padded shoulder strap to meet different requirements for both men and women; made from highly rip and water-resistant polyester fabric, provide strengthen and long-lasting performance; roomy enough for your traveling requirements also having a Rain cover.",Amazing Bags,B0BHX7GY16
"Wildcraft Nylon 35 L Broken Camo Green Casual Backpack (Grey, H x W x D:46x32x24)",https://www.amazon.in//Wildcraft-Nylon-Broken-Casual-Backpack/dp/B083ZSY54M/ref=sr_1_226?keywords=bags&qid=1692643113&sprefix=%2Caps%2C415&sr=8-226,"₹1,149",4.0 out of 5 stars,(90)," Care Instructions: Hand Wash Only  
 Material : Nylon Wrinkle Fabric; Double compartment bag with multi-level organiser,Multi-level organiser that keeps everything clutter-freeIn-built rain cover to keep everything warm and dry,Sleeve separator section for essentials.<br>  
 Side fabric pocket for water bottle,Quick grab padded haul-loop for ease of carrying<br>  
 Gusseted front tiffin pocket,Motorcycle Storm Printed Flap<br>  
 The nylon wrinkle fabric has a unique look which is resistant to external stress and retain their shape.The fabrics made from nylon materials inherit resilience and are lightweight<br>  
 Closure Type: Zipper; Strap Type: Padded Strap; Pattern Name: Camouflage; Special Features: Integrated Rain Cover; Water Resistance Level: Water Resistant<br>  
","Side fabric pocket for water bottle,Quick grab padded haul-loop for ease of carrying, Gusseted front tiffin pocket, Motorcycle Storm Printed Flap.",Wildcraft,B083ZSY54M
WildHorn Leather Laptop Messenger Bag for Mens,https://www.amazon.in//WildHorn-Leather-39-37-Messenger-WHBB101/dp/B01H8U62VU/ref=sr_1_227?keywords=bags&qid=1692643113&sprefix=%2Caps%2C415&sr=8-227,"₹2,389",3.9 out of 5 stars,(278)," 1.GENUINE LEATHER: If you love leather, timeless design, fashionable and durable bags, you'll surely love WILDHORN'S Leather Bags.Crafted from leather this bag is meticulously crafted into a adorable, durable & classic masterpiece by highly skilled professionals.Perfect for office, meeting, working, travelling and other occasions  
 2.FUNCTIONAL & STYLISH: Functional design makes it spacious enough to carry all your daily essentials.It has 1 Main Compartment, 1 Front Sub Compartment with dedicated padded compartment for laptop/Macbook,1 front & 1 back zip pocket ,2 Carry Handles with adjustable strap. Dimension: L-16 inch W-4 inch H-12 inch  
 3.ART OF CRAFTSMANSHIP:Designed by highly trained designers with latest trend analysis. This bag reflects a perfect balance between utility,design and convenience.The most distinguishing feature of this product is that the leather may have wrinkles,scratches,shade,grain and natural markings that are enherent characteristics and reflect the natural beauty of the hide.  
 4.PERFECT COMPANION : This bag is preferable for all age groups and can be carried on all occasions. A Perfect companion whether it be a Student,Workaholic/Shopaholic or Traveller,this bag serves all purpose-need. This perfect bag is designed for all-day comfort and can be a perfect present for Men. Father's day, Anniversary,Graduation Day,Friendship Day or birthday, this elegant bag is a great gift idea for Men.  
 5.NOTE : Product colour may slightly vary due to photographic lighting sources or your monitor settings. This bag has been made out of leather with durable lining, trims and it’s a natural thing where colour variation is never under control.  
",,"ADL International, ADL International, 61/H G.J.Khan Road, Topsia, Kolkata-700039",B01H8U62VU
Skybags Unisex Black Jacqard 34L Laptop Bags,https://www.amazon.in//Skybags-Unisex-Black-Jacqard-Laptop/dp/B09ZV81F6M/ref=sr_1_228?keywords=bags&qid=1692643113&sprefix=%2Caps%2C415&sr=8-228,"₹1,127",3.9 out of 5 stars,(55)," Care Instructions: Hand Wash Only  
 Ideal for a working professional travelling to work by bus, train, ola/uber/cab etc. Laptop compatibility & professional looking backpack  
","Ideal for a working professional travelling to work by bus, train, ola/uber/cab etc. Laptop compatibility & professional looking backpack","VIP Industries Limited, DGP House,88C, Old Prabhadevi Road, Prabhadevi, Mumbai 400025. India, VIP Industries Limited, DGP House,88C, Old Prabhadevi Road, Prabhadevi, Mumbai 400025. India",B09ZV81F6M
