"Tabelito® NEO 3O L Water Resistant Laptop/College/Office/School/Travel/Business Bag, Unisex Backpack for Men Women Fits Up to 15.6 Inch Laptop Notebook.",https://www.amazon.in//Tabelito-NEO-Backpack-Business-Compartment/dp/B0C2D2Q52R/ref=sr_1_83?keywords=bags&qid=1692642347&sprefix=%2Caps%2C415&sr=8-83,₹399,4.0 out of 5 stars,(190)," Care Instructions: Hand Wash Only  
 The front and side zipper compartments of the backpack make it simple to store items like tablets, diaries, pens, pencils, smartphones, cards, change and other small items. The backpack's side pockets make it easy to carry along tiny goods like mini umbrellas and water bottles.  
 MADE IN INDIA - This ""MAKE IN INDIA"" laptop bag for men has 2 front zip pockets, 2 side bottle pockets, and 1 huge zipped section. For men, women, boys, and girls, this bag works great for the office, school, and college. In fact, it's the ideal all-purpose backpack for men, school bags for girls and boys, college bags for girls and boys and workplace bags for unisex  
 LAPTOP BACKPACK SPECIFICATIONS - Men's NEO Laptop Backpack; Compartment Size: Up to 15.6 Inches. 30 litres is the capacity. 15 x 11.5 x 3 inches in size.  
 NEO padded laptop backpack with internal organiser and sleeve that can handle up to 15.6"" laptops. Compatible laptops include those made by HP, Lenovo, Acer, ASUS, and Dell. Your keys, cords, office supplies, and other valuables can be neatly organised inside the organiser to avoid theft.  
 The Tabelito Casual Backpack is entirely produced in India and goes through strict quality inspections and tests. Water Resistant Material: The material has an advanced IPX4 coating that prevents water from penetrating from any angle.  
 The backpack features a 30L capacity and a padded laptop pocket that fits a 15.6 inch laptop. Additional necessities that can fit within are a lunchbox, charger, tablet, books, power bank, wallet, and sunglasses.  
","Decent BACKPACK: The Tabelito Backpack / Daypack is made of HIGH QUALITY Anti Scratch Fabric with a sturdy zipper design, making it incredibly sturdy, tear-resistant, and capable of protecting your items from dust, rain, and filth. Even more robust and long-lasting are the strong buckle and zipper. LARGE CAPACITY & MULTI COMPARTMENTS & LIGHT WEIGHT: The backpack has three compartments. There is ample storage for clothes, books, a lunchbox, daily needs, and tech equipment accessories in the separate laptop compartment that fits a 15.6-inch laptop as well as a 15-inch, 14-inch, and 13-inch or Mac book. The middle compartment has enough capacity for a laptop charger, an iPad, a tablet, a smartphone, a document file, and other necessary accessories. There are two small elastic mesh side pockets for water bottles and a front compartment with zipper pockets for easy access items like a mask, wallet, metro card, and wallet. Make your goods more accessible and organised. HIGH QUALITY MATERIAL: The metal zippers on our backpack are made of high-quality, water-resistant Polyester fabric. Lightweight and strong build guarantee daily use that is safe and durable. Perfect for shopping, office work, business travel, weekend trips, and other outdoor activities. It is also the ideal backpack for teens, boys, girls, adults, and other genders.","Tabelito Trade India, Tabelito Trade India, Tabelito Trade India, Prop No 5, Ground Floor, Kh No641, Village Rithala, Land Mark Near Suzuki service center (Rithala), Contact  +919958166528",B0C2D2Q52R
"Safari Flash Casual Backpack, 26 ltr Water Resistant Travel Bags| Weight Polyester Bagpack for Men and Women, Spacious Shoulder Bag for College, Office, Travelling and Camping",https://www.amazon.in//Safari-Backpack-Resistant-Polyester-Travelling/dp/B09B26VHXV/ref=sr_1_84?keywords=bags&qid=1692642347&sprefix=%2Caps%2C415&sr=8-84,₹809,3.8 out of 5 stars,"(3,150)"," HIGH QUALITY FABRIC: Our lightweight yet durable bags are made of 100% polyester and water resistant fabric. This casual backpack can be by boys and girls for school, college, coaching, tution, or everyday outings.  
 FRONT POCKET: Our trendy unisex bag pack has a front storage pocket that keeps small items neatly organized and easy to access  
 MESH POCKET: Our fancy and stylish backpacks have mesh pockets on both sides to accommodate your water bottle and umbrella  
 COMFORT: Our 26 liter bag has mesh padding on back to help carry heavy items. It also provides superior comfort with padded adjustable shoulder straps; WARRANTY: All of our bags come with 1-year International Warranty against manufacturing defects  
 Age Range Description: Adult; Closure Type: Zipper  
",,"Safari Industries, 302-303, A Wing, The Qube CTS No.1498, A/2, Sir Mathuradas Vasanji Rd, Marol, Andheri East, Mumbai, Maharashtra 400059",B09B26VHXV
"Red Lemon Swiss Cut Design 15.6 Inch Smart Laptop Backpack Bag With USB Charging Port, Anti Theft Pocket and Accessories Organiser for Men Women Boys Girls",https://www.amazon.in//sspa/click?ie=UTF8&spc=MTozOTAxNzg1Mjc5NzYxNjg2OjE2OTI2NDIzNDc6c3BfYnRmOjIwMTY2NjExNzYyNzk4OjowOjo&url=%2FRed-Lemon-Capacity-Backpack-Multifunctional%2Fdp%2FB09RK4BRPM%2Fref%3Dsr_1_85_sspa%3Fkeywords%3Dbags%26qid%3D1692642347%26sprefix%3D%252Caps%252C415%26sr%3D8-85-spons%26sp_csd%3Dd2lkZ2V0TmFtZT1zcF9idGY%26psc%3D1,"₹1,899",4.4 out of 5 stars,"(1,144)"," PREMIUM MATERIAL: This multifunctional bag is made of quality Water Repellent polyester material in black color to protect your goods from water. For the inner lining, soft feel premium polyester is used. The hardware such as strengthened hooks, zippers and buckles used are wear resistant, smooth, and durable. <br>  
 LARGE CAPACITY : Comes with 2 compartments with one separate cushioned laptop sleeve to hold 15. 6 inch Laptop. Additional front zipper pockets with an organiser to store magazine, pens, key,music, cosmetic, pen, charger, powerbank, cable etc. Side pockets for water bottles,umbrella. Back hidden anti theft pocket can hold your wallet,phone,etc <br>  
 TROLLEY STRAP & CONVENIENCE : The insertible pull rod box design allows the bag to slide over the luggage handle for easy mobility during traveling. Comfortable airflow back ergonomics design with soft padding, gives you maximum back support. Breathable and adjustable shoulder straps relieve the stress of shoulder. Foam padded top handle for a long time carry on. <br>  
 ONE YEAR WARRANTY: 1-year warranty on this bag against any manufacturing defects. Just keep your documents safe. Contact Red Lemon for any issues regarding the product and a resolution will be provided.; Lining texture: polyester <br>  
 Water Resistance Level: Waterproof; Special Features: Laptop Compartment; Age Range Description: Adult; Pattern Name: Solid; Material Type: Nylon; Pocket Description: Utility Pocket <br>  
",,,B09RK4BRPM
"Half Moon Curiosity 35L Water Resistant 15.6"" Laptop Bag for Men/Backpack for Men, Black | Office Bag for Men/Office Bag for Women with Padded Laptop Compartment | Rain Cover & Slim Durable Backpack",https://www.amazon.in//sspa/click?ie=UTF8&spc=MTozOTAxNzg1Mjc5NzYxNjg2OjE2OTI2NDIzNDc6c3BfYnRmOjIwMTQ1OTk1NzYyMTk4OjowOjo&url=%2FHalf-Moon-Curiosity-Backpack-Resistant%2Fdp%2FB09S3ZK3N1%2Fref%3Dsr_1_86_sspa%3Fkeywords%3Dbags%26qid%3D1692642347%26sprefix%3D%252Caps%252C415%26sr%3D8-86-spons%26sp_csd%3Dd2lkZ2V0TmFtZT1zcF9idGY%26psc%3D1,₹849,3.8 out of 5 stars,(190)," Care Instructions: Hand Wash Only  
 SPACIOUS & MULTI UTILITY: The backpack for men has capacity of 35 litres, which means it is triple times the normal requirement of a backpack. This laptop bag for men comes with a convenient LAPTOP SLEEVE inside the main compartment. The office bag for men / office bag for women has got several straps, buckles, and pockets that make it suitable for adjusting a lot of travel stuff. This college bags for men will facilitate you in all your sports, camping and hiking trips.  
 COMFORT WITH QUALITY: This laptop bag for men has Wide, Padded and Adjustable shoulder straps and Padded Back for comfort in carrying heavy items. The backpack for men is stitched properly and has Bartacks on every pressure point for extra durability. The office bag for men / College Bags for men is made with strong yet light weight polyester fabric with heavy zippers. The office bag for women also comes with a Rain cover so that you can travel during rainy season without any problem.  
 SMART & TRENDY LOOKS: This college bags for boys is smart, trendy and stylish in looks. The multipurpose laptop bag for men looks smart, athletic and venturesome and the blend of grey and red makes it appear exquisite.  
 ENDURING & LONG LASTING: This laptop bag for men / backpack for men is made up of highly durable material, which makes it suitable for all weather conditions including heavy rains and extreme scorching heat. It will not only keep the inside stuff safe but will also resist damage to itself.  
 OTHER FEATURES OF BACKPACK FOR MEN: The Laptop backpacks for men / office bag for men has Rain Cover, 17 inch Laptop compartment, Internal Organiser (Small Pockets), Strong and durable zippers, Adjustable Shoulder Handles (Straps) , 2 Bottle/Umbrella holders , Padded Handle , Padded Laptop Compartment , Ergonomic Design, Reflector Logo, etc""  
",,Half_Moon(Amazing Bags),B09S3ZK3N1
POLICE Backpack for Men Casual Laptop Bag Office/Travel/College 30 Ltr Hedge Polyester - Black,https://www.amazon.in//sspa/click?ie=UTF8&spc=MTozMjgyNjIwOTg4MjMwNTEwOjE2OTI2NDI0MzI6c3BfYXRmX25leHQ6MzAwMDEzMzQyOTgzODMyOjowOjo&url=%2FPolice-Polyester-laptop-casual-backpack%2Fdp%2FB09CQ5T3LN%2Fref%3Dsr_1_81_sspa%3Fkeywords%3Dbags%26qid%3D1692642432%26sprefix%3D%252Caps%252C415%26sr%3D8-81-spons%26sp_csd%3Dd2lkZ2V0TmFtZT1zcF9hdGZfbmV4dA%26psc%3D1,"₹1,399",4.1 out of 5 stars,"5,852"," Care Instructions: Hand Wash Only  
 Backpack  
",Backpack,,B09CQ5T3LN
"HOEXL 42L Expandable Laptop Backpack - Premium Laptop Backpacks for Men, Women for Travel, School, College - Tech Bag with USB - Bagpacker Bag for Men, 17 inch Laptop Bags for Multipurpose with Water-resistant, Smart Bag with Multiple Compartments",https://www.amazon.in//sspa/click?ie=UTF8&spc=MTozMjgyNjIwOTg4MjMwNTEwOjE2OTI2NDI0MzI6c3BfYXRmX25leHQ6MzAwMDEyMzM5NDMyODMyOjowOjo&url=%2FHOEXL-Expandable-Laptop-Backpack-Water-resistant%2Fdp%2FB0C3J2RLHP%2Fref%3Dsr_1_82_sspa%3Fkeywords%3Dbags%26qid%3D1692642432%26sprefix%3D%252Caps%252C415%26sr%3D8-82-spons%26sp_csd%3Dd2lkZ2V0TmFtZT1zcF9hdGZfbmV4dA%26psc%3D1,"₹2,699",5.0 out of 5 stars,33," Care Instructions: Hand Wash Only  
 The Ultimate Expandable HOEXL Backpack - Unlock the limitless potential of our HOEXL backpack. With its ingenious expandable feature, effortlessly transition from 25 Litre to a generous 42 Litre capacity. Adapt to any situation, whether it's daily commuting or weekend getaways, and carry more with ease. It comes with 100% guarantee and 2 year HOEXL trust warranty.  
 Convertible HOEXL Travel Backpack - This versatile backpack offers three modes - shoulder mode, office mode, and luggage or suitcase mode - providing you with the ultimate convenience for any situation. Carry it comfortably on your shoulder, effortlessly transition to a sleek office bag, or convert it into a spacious luggage for your traveling needs. With its stylish design, durable construction, and ample storage space, this back pack is the epitome of versatility  
 Multiple Compartments for Better Storage - your ultimate companion for organized and efficient travel. With three dedicated compartments, this backpack offers ample storage for your personal belongings, clothing, and electronic devices. Safely store your laptop and computer in separate compartments while keeping pens, phone and accessories organized in convenient pockets. This is designed to streamline your life and keep all your essentials within reach.  
 USB Port Backpack - This innovative backpack features a built-in USB port, allowing you to conveniently charge your devices while on the move. Simply connect your charger to the internal cable and stay powered up throughout your day. With its spacious compartments and comfortable design, this backpack is perfect for carrying your essentials and keeping your devices charged wherever you go.  
 Water-Resistant Laptop Backpack - A durable and reliable companion for all your adventures. Crafted with high-quality oxford materials, this backpack is built to withstand the elements and protect your belongings from water damage. Its rugged construction ensures long-lasting durability, making it perfect for daily use and outdoor activities. With its spacious compartments and ergonomic design, this backpack provides ample storage and comfortable carrying.  
",,"HOEXL, SSRN Enterprises",B0C3J2RLHP
"FUR JADEN Anti Theft Number Lock Backpack Bag with 15.6 Inch Laptop Compartment, USB Charging Port & Organizer Pocket for Men Women Boys Girls",https://www.amazon.in//Number-Backpack-Compartment-Charging-Organizer/dp/B09VTCNN75/ref=sr_1_83?keywords=bags&qid=1692642432&sprefix=%2Caps%2C415&sr=8-83,₹679,4.0 out of 5 stars,"5,603"," Care Instructions: Wipe with Damp Cloth  
 Number Lock: This Fur Jaden Anti Theft laptop backpack comes equipped with a Number Lock. This helps keep your laptop and other belongings safe when you need to leave your bag unattended in a public space. The number lock sequence can be changed and customised by your directly.<br>  
 USB Charging Port: Now charge your devices on the go with your new Fur Jaden backpack without the hassle of carrying a bulk power bank in your pocket/ hand at all times.<br>  
 Ergonomic Design: This backpack has been designed to ensure equal weight distribution on your shoulders along with padded shoulder straps and breathable air mesh on the back.<br>  
 Dimension: 42 CM (L) x 30 CM (W) x 18 CM (D). Storage Capacity: 25L. Weight: 600 Grams; Warranty: 1 Year Manufacturer Warranty against Manufacturing Defects<br>  
 Closure Type: Zipper; Lining Description: Polyester; Age Range Description: Adult<br>  
","Stay organized all day with a durable and lightweight backpack from Fur Jaden. This back pack is a stylish and functional accessory for men and women. Can add admiration to an appealing and daring personality with a remarkable aesthetics and functionality. This backpack features an anti-theft design. You can also charge your phone on the go and organize your stuff like pro. Fur Jaden functional back pack is apt to protect your gadgets and belongings from being stolen while you travel, thanks to its special anti-theft design. Now keep your belongings safe with style. The backpack features multiple compartments that you may use for your laptop and other essentials. A remarkable feature of this backpack allows you to charge your phone while you are on the move. With an attached charging dock in the back you may connect a portable power bank with ease. Weighing about 600grams, this backpack is lightweight. The backpack is able to house a laptop of up to 15.6 inches and has seven inner compartments to place your other essentials. Made from durable quality polymer this Fur Jaden back pack is sturdy and reliable. Flaunt this bag with style and low maintenance as this bag is washable. This backpack is also suitable for school or college. The straps are designed to distribute the weight equally on each shoulder preventing any sort of discomfort. Use this back pack for office, college/school or during travels.","FUR JADEN, Fur Jaden, 3C Jai Hind Bld, Dr AM Road, Bhuleshwar, Mumbai 400002",B09VTCNN75
"Skybags Unisex Printed School Backpack For Kids, 02 Red, (Marvel Spiderman)",https://www.amazon.in//Skybags-Unisex-Printed-Backpack-Spiderman/dp/B0C5X1PTYW/ref=sr_1_84?keywords=bags&qid=1692642432&sprefix=%2Caps%2C415&sr=8-84,₹996,4.2 out of 5 stars,24," 3 Compartment  
 Marvel Print  
 Fabric Pockets on Both Sides  
 Padded Shoulder Strap  
 Fabric Pcket on Both Side  
","For the busy-bee new age student toggling between the many worlds of school, tutions, dance, skating, tennis or Karate practise the SKYBAG range of stylish and functional backpacks caters to the entire spectrum of the students demanding schedule",,B0C5X1PTYW
Bennett™ Mystic Unisex Adult Men's Laptop Bag 15.6 inch Side Shoulder Briefcase Satchel Messenger Business Bags for Men & Women Front Pocket for Laptop Accessories - Black (6 Month Warranty),https://www.amazon.in//BennettTM-Shoulder-Messenger-Repellent-Charcoal/dp/B09CV24TMK/ref=sr_1_85?keywords=bags&qid=1692642432&sprefix=%2Caps%2C415&sr=8-85,₹512,4.0 out of 5 stars,"6,454"," PREMIUM QUALITY MATERIAL: This laptop computer briefcase is made of high-quality water repellent fabric, and well-made of foam pad inside. The laptop briefcase equipped with a removable shoulder strap and a soft carry handle, you can easily switch the carry way you want.  
 LIGHTWEIGHT AND MULTIFUNCTIONAL: It provide a removable shoulder strap, can be use as shoulder bag or handbag base on your need; top handle strap, and comes with adjustable strap with. It will be a good partner for your daily use or business trip.  
 EXCELLENT DETAILS: The laptop bag with exquisite zippers, durable hook of strap and soft handle, which make it more comfortable to carry and use. Ensure a secure and long-lasting usage everyday as office work bag, travel laptop briefcase, business laptop case, college laptop bag.  
 DIMENSION: External: 16 x 12 x 3 inch; Dimension: 16.5 x 11.5 x 2.5 inch. Suitable for 14-15.6 inch: Dell, Acer, ASUS, Samsung, HP and other brand laptops.(Please allow a little size different because of manual measurement). Great gifts choice for birthday, work anniversary.  
 BENNETT Warranty: Exchange within (6 months) if you don't like. If any problems, please do not hesitate to contact us. We will provide the best solution for you.  
›
",,,
Gear Campus8 25L Water Resistant School Bag/Backpack/College Bag for Men/Women - Green Grey,https://www.amazon.in//Gear-Classic-Casual-Backpack-BKPCAMPS80304/dp/B019FBEJCO/ref=sr_1_86?keywords=bags&qid=1692642432&sprefix=%2Caps%2C415&sr=8-86,₹674,4.1 out of 5 stars,"1,244"," Outer Material: Polyester, Inner Material: Suede, Color: Green and Grey  
 Scratch Resistant: Wear resistant, Water resistance: Water resistant; Dimensions: 49 cms x 32 cms x 16 cms (LxWxH)  
 Number of compartments: 2  
 Shoulder Strap Drop: 36 cm  
 Two wide-access main compartments with internal file separator and non-padded sleeve, one additional front pocket, embedded organizer, reinforced grab handle and bartacked load points, double pullers for main compartments, padded anti-sweat shoulder straps, padded back panel and base and Water resistant fabrics  
 Zippered wide access  
 Two Wide-Access Main Compartments With Internal File Separartor/Non-Padded Sleeve  
Two Wide-Access Main Compartments With Internal File Separartor / Non-Padded Sleeve
One Additional Front Pocket
Embedded Organizer
Reinforced Grab Handle And Bartacked Load Points
Double Pullers For Main Compartments
Padded Anti-Sweat Shoulder Straps
Padded Back Panel And Base
Water Resistant Fabrics
Show More
","Intuitively crafted at the Gear Design Studio to balance comfort, style, endurance and functionality.","Gear Merchandise PVT LTD, Gear Merchandise PVT LTD E/12 West Chowbaga Gulshan colony KoLkata-700100 Contact 9830403366",B019FBEJCO
DEIN KLEIDER Men's Nylon Messenger Bag,https://www.amazon.in//Kleider-Travel-Business-Messenger-Shoulder/dp/B084ZHP97M/ref=sr_1_87?keywords=bags&qid=1692642432&sprefix=%2Caps%2C415&sr=8-87,₹349,4.0 out of 5 stars,"5,285"," ERGONOMIC DESIGN: This ergonomic bag features zippered security pockets in the front, back and main compartment. The front pockets can be used to hold personal items like identification cards, keys and more while the extra pocket located in the back can be used for the storage of sleek items like mobile devices. The main storage pocket also has enough room to hold your gadgets, small water bottle cables, chargers etc. This bag can fit tablets and devices with screen sizes of up to 10.5.<br>  
 WATER, DIRT & SLASH RESISTANT: This cross body bag by Dein Kleider is ideal for people who are adventurous and always on the go. Its padded storage is resistant to water, dirt and even a slash by sharp objects, so you dont have to worry about anything. This bag is durable and heavy duty, ensuring that your gadgets and valuables are safely stored.<br>  
 CRAFTED IN INDIA: Dein Kleider cross body sling is crafted with perfection by professional Indian artisans in an elegant style that makes your presence truly class apart. Its an ideal companion for a comfortable all day carry to school/college, malls, morning walk, office and meetings. It can also be easily used as travel accessory for a train or bus journey.<br>  
 Outer Material Type: Nylon  
","Spacious and convenient, ideal for use as Messenger Bag.perfect product from DEIN KLEIDER for storing in your Objects to take with you for extra storage.",,B084ZHP97M
Skybags Unisex Grey Jacqard 34L Laptop Bags,https://www.amazon.in//Skybags-Unisex-Grey-Jacqard-Laptop/dp/B09ZV9SLBJ/ref=sr_1_88?keywords=bags&qid=1692642432&sprefix=%2Caps%2C415&sr=8-88,"₹1,248",4.1 out of 5 stars,85," Care Instructions: Hand Wash Only  
 Ideal for a working professional travelling to work by bus, train, ola/uber/cab etc. Laptop compatibility & professional looking backpack  
","Ideal for a working professional travelling to work by bus, train, ola/uber/cab etc. Laptop compatibility & professional looking backpack","VIP Industries Limited, DGP House,88C, Old Prabhadevi Road, Prabhadevi, Mumbai 400025. India, VIP Industries Limited, DGP House,88C, Old Prabhadevi Road, Prabhadevi, Mumbai 400025. India",B09ZV9SLBJ
Half Moon Valex Unisex School Bag/ 15.6 inch Laptop Backpack/College Bagpack/Office Back Packed | Laptop Bag for Men & Women | School Bags for Boys & Girls with Small Pockets & Laptop Compartment,https://www.amazon.in//Half-Moon-Laptop-Bag-Compartment/dp/B0C1NZLF67/ref=sr_1_89?keywords=bags&qid=1692642432&sprefix=%2Caps%2C415&sr=8-89,₹649,3.7 out of 5 stars,93," Trendy Design: The Laptop bag for men features a unique, trendy design that makes it stand out from other laptop backpacks. It's perfect for individuals who want to express their style while carrying their laptop.  
 Secure Laptop Compartment: The 17-inch padded compartment in laptop backpack for men / Laptop bag for men provides secure storage for your device. The padding ensures that your laptop is protected from scratches and bumps while you're on the move.  
 Front Pockets: The small pockets in College Bags for men / College bag for women in Second Compartment provide easy access to smaller items like your phone, wallet, and keys. These pockets are convenient and ensure that you don't have to dig through the main compartment to find what you need.  
 Strong Built: The Laptop bag for men is built with strong zippers and stitching that can withstand daily wear and tear. This ensures that your belongings are kept safe and secure in college bag for girls and the backpack for men can hold up to daily use.  
 Comfortable to Wear: The Laptop bag for men / backpack for men is designed for maximum comfort. The padded shoulder straps and back panel provide added comfort, reducing strain on your back and shoulders while carrying the laptop backpack. This makes it easy to wear the backpack for extended periods of time, whether you're commuting to work or school or going on a trip.  
",,Half_Moon,B0C1NZLF67
Gear Vintage2 28L Medium Size Faux Leather Water Resistant Anti Theft Unisex Laptop Backpack- Brown,https://www.amazon.in//Gear-Vintage2-Leather-Backpack-LBPVG2LTH0201/dp/B07G4D13L7/ref=sr_1_90?keywords=bags&qid=1692642432&sprefix=%2Caps%2C415&sr=8-90,₹979,4.4 out of 5 stars,"4,386"," Care Instructions: Hand Wash Only  
 Capacity: 28 liters; Weight: 600 grams; Dimensions: 48 cms x 33 cms x 18 cms (LxWxH)  
 Concealed quick access Pockets on back panel; Adjustable Anti sweat padded Shoulder straps , Padded Laptop sleeve  
 3 External Pockets, Padded Back Panel Cushioned with Anti Sweat Fabric, Embedded Organizer, USB and Headphone cable slot  
 Concealed quick access Pockets on back panel ,Adjustable Anti sweat padded Shoulder straps , Padded Laptop sleeve,3 External Pockets, Padded Back Panel Cushioned with Anti Sweat Fabric,Embedded Organizer , USB and Headphone cable slot  
 Special Features: Back Padding; Closure Type: Zipper; Pocket Description: Utility Pocket; Age Range Description: Adult; Water Resistance Level: Waterproof  
 Concealed quick access Pockets on back panel ,Adjustable Anti sweat padded Shoulder straps , Padded Laptop sleeve,3 External Pockets, Padded Back Panel Cushioned with Anti Sweat Fabric,Embedded Organizer , USB and Headphone cable slot .  
","Gear bags are designed for the quick commute as well for the long journey. these backpacks can be used as laptop bags,adventure bags and so on. Your favorite travel companion, The backpacks come with enough storage space to carry all your requirements.","Gear Merchandise PVT LTD, Gear Merchandise PVT LTD E/12 West Chowbaga Gulshan colony KoLkata-700100 Contact 9830403366",B07G4D13L7
